ISWC;workId;title;creators;source
T0618096471;906059551;A L INFINI;CHIRESCU YOAN MARKUS, FURLER SIA KATE I, JUDRIN RAPHAEL DAVID, LISBONNE SILVIO, MELKI PIERRE-ANTOINE JOSEPH MICHEL, ROMITI MANON;ASCAP
T9209683512;892098556;A L'INFINI;CHIRESCU YOAN MARKUS, FURLER SIA KATE I, JUDRIN RAPHAEL DAVID, LISBONNE SILVIO TRISTAN, MELKI PIERRE-ANTOINE JOSEPH MICHEL, ROMITI MANON LISA;ASCAP
 ;918641753;ABOUT U;AHR GUSTAV ELIJAH, BROBACK NICK, CAREY DAN, FURLER SIA KATE I;ASCAP
T0608218478;311809755;ACADEMIA;CAREY DANIEL DE MUSSENDEN, FURLER SIA KATE I;ASCAP
T0614136694;885138319;ACID RAIN;BAUMER PAUL, ERIKSEN MIKKEL STORLEER, FURLER SIA KATE I, HERMANSEN TOR ERIK, HOOGSTRATEN MAARTEN;ASCAP
T0616342892;889405090;ALIVE;ADKINS ADELE LAURIE BLUE, FURLER SIA KATE I, JESSO TOBIAS MACDONALD;ASCAP
T0617310061;891650038;ALIVE;FURLER SIA KATE I, GELLER JESSE ST JOHN, MICHAELS GRANT PHILLIP;ASCAP
T0611563644;881528646;ALL I NEED;AGUILERA CHRISTINA, DIXON SAMUEL RONALD, FURLER SIA KATE I;ASCAP
T0611979726;882157695;ALL IN YOUR HEAD;CAREY DANIEL DE MUSSENDEN, FURLER SIA KATE I;ASCAP
T0616538103;890049303;ANGEL BY THE WINGS;FURLER SIA KATE I, KURSTIN GREG;ASCAP
T9283171493;896777299;ANGEL IN YOUR EYES;FURLER SIA KATE I, MCKENZIE TIMOTHY LEE, PENTZ THOMAS WESLEY;ASCAP
T9270569589;896119439;ANTHEM;FURLER SIA KATE I, KURSTIN GREG;ASCAP
T9235767767;894062309;ARRESTED;EPWORTH PAUL RICHARD, FURLER SIA KATE I;ASCAP
T9243592247;894785761;AUDIO;ALLEN HENRY, FURLER SIA KATE I, MCKENZIE TIMOTHY LEE, MECKSEPER PHILIP, PENTZ THOMAS WESLEY;ASCAP
T9290736231;896467967;BABY;FURLER SIA KATE I, KURSTIN GREG, MCDONALD MAUREEN ANNE;ASCAP
T0611979715;882157694;BAD RECEIVER;CAREY DANIEL DE MUSSENDEN, FURLER SIA KATE I;ASCAP
 ;889168169;BALLADINO;FURLER SIA KATE I, KRAUS OLIVER, LEAK JASPER, LEAK JASPER MAXIMILLIAN;ASCAP
T0615265569;888328219;BANG MY HEAD;FURLER SIA KATE I, GUETTA PIERRE DAVID, KARLSSON CHRISTIAN LARS, LIDEHALL MAGNUS CARL ERIK, PONTARE VINCENT FRED, ROTTEVEEL NICK, TUINFORT GIORGIO H, WATTUM VAN MARCUS C;ASCAP
T9238753270;894062426;BANG MY HEAD FEAT SIA AND FETTY WAP;FURLER SIA KATE I, GUETTA DAVID, KARLSSON CHRISTIAN, LIDEHALL MAGNUS CARL ERIK, MAXWELL WILLIE, PONTARE VINCENT, ROTTEVEEL NICK, TUINFORT GIORGIO H, WAXLER MARCUS C;ASCAP
T0614197011;885215852;BATTLE CRY;ANGEL HAZE, FURLER SIA KATE I, KURSTIN GREGORY ALLEN;ASCAP
T9090747823;884657105;BATTLEFIELD;FURLER SIA KATE I, GOLDINGS LAWRENCE S;ASCAP
T9049302912;884022249;BE GOOD TO ME;FURLER SIA KATE I, GRAHAM JESSE, KATZ SIMON LAURENCE;ASCAP
T0607667708;321522554;BEAUTIFUL CALM DRIVING;DIXON SAMUEL RONALD, FURLER SIA KATE I;ASCAP
T9144340692;886606268;BEAUTIFUL PAIN;FURLER SIA KATE I, HAYNIE EMILE, MATHERS MARSHALL B, RESTO LUIS EDGARDO;ASCAP
T9243400999;894732006;BEAUTIFUL PEOPLE SAY;ERIKSEN MIKKEL STORLEER, FURLER SIA KATE I, HERMANSEN TOR ERIK;ASCAP
T3008529037;909354083;BEAUTIFUL PEOPLE SINGLE;DRO, FENTY ROBYN R, FURLER SIA KATE I;ASCAP
T0617935779;893195964;BEAUTIFUL THINGS CAN HAPPEN;CORBY MATT JOHN, FURLER SIA KATE I;ASCAP
T0614761226;885675599;BEFORE I SLEEP;BINNS HENRY, BRUCE BO, FURLER SIA KATE I, KURSTIN GREGORY ALLEN;ASCAP
T9209269090;891966596;BEST DAY EVER;FURLER SIA KATE I, VALENSI NICK;ASCAP
 ;322566630;BETTER;DOHERTY ROYCE ALAN M, FURLER SIA KATE I;ASCAP
T0611555635;881482164;BIG GIRL / LITTLE GIRL;BINNS HENRY, FURLER SIA KATE I;ASCAP
T0611555635;908738203;BIG GIRL/LITTLE GIRL;BINNS HENRY, FURLER SIA KATE I;ASCAP
T9142663158;887002200;BIRD SET FREE;FURLER SIA KATE I, KURSTIN GREGORY ALLEN;ASCAP
T0608917516;321321413;BITING TONGUES;BOGLE SIMON, FURLER SIA KATE I, KOSTEN DAVID JEREMY;ASCAP
T9247072737;885187532;BLACK BUTTERFLY;BRAIDE CHRISTOPHER KENNETH, BROMFIELD DIONNE, FURLER SIA KATE I;ASCAP
T0608774419;883896858;BLAME;FRANK SAM, FURLER SIA KATE I;ASCAP
 ;321796992;BLAME IT ON THE RADIO;CAREY DANIEL DE MUSSENDEN, FURLER SIA KATE I;ASCAP
 ;322001758;BLAME IT ON THE RADIO;CAREY DANIEL DE MUSSENDEN, FURLER SIA KATE I;ASCAP
T0613806306;884792171;BLANK PAGE;AGUILERA CHRISTINA, BRAIDE CHRIS, FURLER SIA KATE I;ASCAP
T9143508207;887043196;BLINDED BY LOVE;FURLER SIA KATE I, GARIBAY FERNANDO;ASCAP
T3090269942;911897751;BORN YESTERDAY;COLEMAN JEREMY MICHAEL, FURLER SIA KATE I, GHERSI RODRIGUEZ ALEJANDRO;ASCAP
T0615592670;887907942;BOTTLE;FURLER SIA KATE I, KURSTIN GREGORY ALLEN;ASCAP
T0615414260;887336290;BOTTOMS UP;FURLER SIA KATE I, PIERSON KATE, VALENSI NICK;ASCAP
T0611980234;882161075;BOUND TO YOU;AGUILERA CHRISTINA, DIXON SAMUEL RONALD, DIXON SAMUEL RONALD, FURLER SIA KATE I;ASCAP
 ;888863161;BOY PROBLEMS;FURLER SIA KATE I, JEPSEN CARLY RAE, JEPSEN CARLY RAE, KURSTIN GREG;ASCAP
T0613826495;884505658;BREAK THE WALLS;FITZPATRICK MICHAEL, FURLER SIA KATE I, KARNES JOSEPH SCOTT, KING JAMES MIHDI, RUZUMNA JEREMY, SCAGGS NOELLE A, SEEFRIED CHRISTOPHER, WICKS JOHN MEREDITH;ASCAP
T0614502714;885811530;BREATHE;CORNISH JESSICA, ERIKSEN MIKKEL STORLEER, FURLER SIA KATE I, HERMANSEN TOR ERIK;ASCAP
T0606070192;321100778;BREATHE ME;CAREY DANIEL DE MUSSENDEN, FURLER SIA KATE I;ASCAP
T9133648530;886211999;BRIGHTEST MORNING STAR;FURLER SIA KATE I, GOTTWALD LUKASZ, SPEARS BRITNEY, WALTER HENRY RUSSELL;ASCAP
 ;321801092;BRING IT TO ME;FURLER SIA KATE I, FURLER SIA KATE I;ASCAP
T0608223115;904869033;BRING IT TO ME;FURLER SIA KATE I;ASCAP
T9148009205;321522572;BRING NIGHT;FURLER SIA KATE I, KURSTIN GREG;ASCAP
T0614761124;885186024;BRING THE PARTY;BRAIDE CHRISTOPHER KENNETH, FURLER SIA KATE I;ASCAP
T0614678613;885186030;BRING YOUR ARMS;BRAIDE CHRISTOPHER KENNETH, FURLER SIA KATE I, PIERSON KATE;ASCAP
T0607393872;904982327;BROKEN BISCUIT;FISCHER CHAD B, FURLER SIA KATE I;ASCAP
T0616536005;890049307;BROKEN GLASS;FURLER SIA KATE I, LEAK JASPER MAXIMILLIAN, SHATKIN JESSE SAMUEL;ASCAP
T0608774453;322067170;BRUISE LIKE A PEAR;FURLER SIA KATE I, KURSTIN GREGORY ALLEN;ASCAP
T0607351847;502120332;BULLY;FURLER SIA KATE I, HANSEN BECK DAVID, HOGARTH JAMES DEARNESS;ASCAP
T9142154276;886977804;BURN THE PAGES;FURLER SIA KATE I, KURSTIN GREGORY ALLEN;ASCAP
T0614423798;885129524;BUST ME OUT;BRAIDE CHRISTOPHER KENNETH, FURLER SIA KATE I;ASCAP
T0607351858;321291134;BUTTERFLIES;CORMACK KEVIN JAMES, FURLER SIA KATE I, HOGARTH JAMES DEARNESS;ASCAP
T0607351858;322401996;BUTTERFLIES;CORMACK KEVIN JAMES, FURLER SIA KATE I, HOGARTH JAMES DEARNESS;ASCAP
T0607403304;321424393;BY YOUR SIDE;FURLER SIA KATE I, KURSTIN GREG;ASCAP
 ;322776458;BYE, BYE, BYE;FISHER CHAD, FURLER SIA KATE I;ASCAP
 ;322888257;BYE, BYE, BYE;FISHER CHAD, FURLER SIA KATE I;ASCAP
T9231477784;893608139;CANDY CANE LANE;FURLER SIA KATE I, KURSTIN GREG;ASCAP
T9294780931;897800270;CANSEI DE SOFRER (LOVED ME BACK TO LIFE);FURLER SIA KATE I, HUSSAIN HASHAM S, MOTES DENARIUS ANTHONY, PAVANELLY MARA;ASCAP
T0607650805;331671991;CAR PARK;FURLER SIA KATE I, KURSTIN GREG;ASCAP
T0608223126;333622638;CARES AT THE DOOR;DIXON SAMUEL RONALD, FURLER SIA KATE I;ASCAP
T9170269724;888921408;CASUALTY;FURLER SIA KATE I, KURSTIN GREGORY ALLEN, MOORE ALECIA B;ASCAP
T0608774475;883896852;CATCHING ON;FRANK SAM, FURLER SIA KATE I;ASCAP
T9142663147;887002185;CELLOPHANE;FURLER SIA KATE I, KURSTIN GREGORY ALLEN;ASCAP
T9209976670;891991978;CHAINED TO THE RHYTHM;FURLER SIA KATE I, HUDSON KATHERYN ELIZABETH, MARLEY MINTO SKIP, MAX MARTIN, PAYAMI ALI;ASCAP
T9209976670;911011695;CHAINED TO THE RHYTHM;FURLER SIA KATE I, MARLEY MINTO SKIP, MAX MARTIN, PAYAMI ALI, PERRY KATY;ASCAP
T9223693412;892947320;CHAMPION;FURLER SIA KATE I, HURLEY ANDREW JOHN, SHATKIN JESSE SAMUEL, STUMPH PATRICK MARTIN, TROHMAN JOSEPH MARK, WENTZ PETER;ASCAP
T3194611326;921169808;CHAMPION;FURLER SIA KATE I, SHATKIN JESSE SAMUEL;ASCAP
T0614910336;886754448;CHANDELIER;FURLER SIA KATE I, SHATKIN JESSE SAMUEL;ASCAP
T9194837393;904314378;CHANDELIER REGGAE COVER;FURLER SIA KATE I, JACK PARRY VERNON;ASCAP
T9192605826;890665359;CHAOS;AALEGRA SNOH, FURLER SIA KATE I, WILSON ERNEST DION;ASCAP
T9316183172;906175370;CHASING PAPER;DIXON SAMUEL RONALD, FURLER SIA KATE I;ASCAP
T0614877007;886603903;CHASING SHADOWS;FURLER SIA KATE I, GARIBAY FERNANDO, KURSTIN GREG;ASCAP
T0616535875;890049305;CHEAP THRILLS;FURLER SIA KATE I, KURSTIN GREG;ASCAP
T9189875294;890325308;CHEAP THRILLS (FEAT SEAN PAUL);FURLER SIA KATE I, HENRIQUES SEAN PAUL, KURSTIN GREG;ASCAP
T0610946865;881101792;CLAP YOUR HANDS;DIXON SAMUEL RONALD, FURLER SIA KATE I;ASCAP
T0607667719;331800912;CLOCKWORK;DIXON SAM, FURLER SIA KATE I, FURLER SIA KATE I;ASCAP
T3082786203;332103718;CLOCKWORK LATEST;DIXON SAM, FURLER SIA KATE I;ASCAP
T3021212788;331800930;CLOUD;DIXON SAM, FURLER SIA KATE I, FURLER SIA KATE I;ASCAP
T0608774486;502351011;CODEPENDANT;FURLER SIA KATE I, KURSTIN GREG;ASCAP
T9047404999;905544525;COLLAPSING;FURLER SIA KATE I, HUNTINGTON NICK, MC GROARTY MICHAEL T;ASCAP
T9316326871;906023424;COLOGNE;FURLER SIA KATE I, KARLSSON CHRISTIAN LARS, LIDEHALL MAGNUS CARL ERIK, PONTARE VINCENT FRED;ASCAP
 ;331983494;COULDN'T MAKE;CAREY DANIEL DE MUSSENDEN, FURLER SIA KATE I;ASCAP
T9282664408;897122157;COURAGE;FURLER SIA KATE I, KURSTIN GREG, MOORE ALECIA B;ASCAP
T9282664419;897122158;COURAGE TO CHANGE;FURLER SIA KATE I, KURSTIN GREG, MOORE ALECIA B;ASCAP
 ;333295797;CRITICISE;DOHERTY ROYCE ALAN M, FURLER SIA KATE I;ASCAP
T9143208757;887185597;CRUSH ME WITH YOUR LOVE;BRAIDE CHRIS, FURLER SIA KATE I;ASCAP
T9214990508;892543823;CRYING IN THE CLUB;CABELLO CAMILA, FRANK DAVID MARTIN, FURLER SIA KATE I, HOIBERG MAGNUS, KIPNER STEPHEN ALAN, LEVIN BENJAMIN JOSEPH, PEREZ NATHAN, SHEYNE PAMELA;ASCAP
T9256201215;888421817;CUT TO THE CHASE;CHARNIN MARTIN, ERIKSEN MIKKEL STORLEER, FURLER SIA KATE I, GLUCK WILLIAM, HERMANSEN TOR ERIK, KURSTIN GREG, LEVIN BENJAMIN, STROUSE CHARLES;ASCAP
T0616846980;895284936;CUT TO THE CHASE;CHARNIN MARTIN, ERIKSEN MIKKEL STORLEER, FURLER SIA KATE I, GLUCK WILLIAM, HERMANSEN TOR ERIK, KURSTIN GREGORY ALLEN, LEVIN BENJAMIN, STROUSE CHARLES;ASCAP
T0617972925;895207647;DAY THAT YOU MOVED ON;FURLER SIA KATE I, MCALL BARNABY JOHNATHON;ASCAP
T9245922241;342652277;DAY TOO SOON;DIXON SAMUEL RONALD, FURLER SIA KATE I;ASCAP
T0608774500;341893232;DEATH BY CHOCOLATE;FURLER SIA KATE I, KURSTIN GREGORY ALLEN;ASCAP
T0617935848;893007654;DEER IN HEADLIGHTS;DIXON SAMUEL RONALD, FURLER SIA KATE I;ASCAP
T0615882557;888635815;DEJA VU;FURLER SIA KATE I, MORODER GIORGIO;ASCAP
T3014186137;908962607;DEL MAR;APONTE JOSE ANTONIO, COTTO JOSE OSVALDO JR, DLAMINI AMALA RATNA, FLORES DONNY, FURLER SIA KATE I, GOTAY ALEXIS, OZUNA ROSADO JAN CARLOS, RIVAS BATISTA STARLIN, RIVERA LOPEZ YAZID ANTONIO, SHATKIN JESSE SAMUEL, VARGAS BERRIOS EDUARDO ALFONSO;ASCAP
 ;894583586;DEMONS;ERIKSEN MIKKEL STORLEER, FURLER SIA KATE I, HERMANSEN TOR ERIK, LEVIN BENJAMIN JOSEPH;ASCAP
T9203770405;891650044;DER MEISTER GRILLT;FURLER SIA KATE I, KURSTIN GREG;ASCAP
T0605064570;340534176;DESTINY;BARKER SOPHIE ALEXANDRA JESSICA, BINNS HENRY DANIEL, FURLER SIA KATE I, HARDAKER SAM;ASCAP
T0608318713;880280326;DESTINY (PHOTEK REMIX);BARKER SOPHIE ALEXANDRA JESSICA, BINNS HENRY DANIEL, FURLER SIA KATE I, HARDAKER SAM;ASCAP
T0617609321;892527767;DEVIL IN ME;FRANGIPANE ASHLEY, FURLER SIA KATE I, KURSTIN GREG;ASCAP
T9310670043;906284989;DIAMANTS;ERIKSEN MIKKEL STORLEER, FURLER SIA KATE I, HERMANSEN TOR ERIK, LEVIN BENJAMIN;ASCAP
T3055786744;912258693;DIAMOND EYES;BENJAMIN EDDIE, FURLER SIA KATE I, SHATKIN JESSE SAMUEL;ASCAP
T0613703471;884664637;DIAMONDS;ERIKSEN MIKKEL STORLEER, FURLER SIA KATE I, HERMANSEN TOR ERIK, LEVIN BENJAMIN;ASCAP
T9093413184;884772770;DIAMONDS (REMIX) (FEAT. KANYE WEST);ERIKSEN MIKKEL STORLEER, FURLER SIA KATE I, HERMANSEN TOR ERIK, LEVIN BENJAMIN, WEST KANYE;ASCAP
T9093413184;916570570;DIAMONDS REMIX;ERIKSEN MIKKEL STORLEER, FURLER SIA KATE I, HERMANSEN TOR ERIK, LEVIN BENJAMIN JOSEPH, WEST KANYE OMARI;ASCAP
T0615031190;886148868;DIM THE LIGHTS;DILLARD LAUREN WILDER, FLAX LAUREN RENEE, FURLER SIA KATE I, MALPASS KEVIN;ASCAP
T0607667731;341399053;DISHWATER;DIXON SAM, FURLER SIA KATE I, FURLER SIA KATE I;ASCAP
T0605064581;340514796;DISTRACTIONS;ALLISON DOROTHY ELLIOT, BINNS HENRY DANIEL, BUCKLEY TIM, FURLER SIA KATE I, HARDAKER SAM;ASCAP
T9282664680;897122184;DIVE;FURLER SIA KATE I, KURSTIN GREG, MOORE ALECIA B;ASCAP
T0608774511;883896854;DO I EXPECT TO BE REJECTED;FRANK SAM, FURLER SIA KATE I;ASCAP
T9327103402;907658908;DOLITTLE;DOUGLAS SEAN, FURLER SIA KATE I, SHATKIN JESSE SAMUEL;ASCAP
T0606765552;341158330;DON T BRING ME DOWN;FURLER SIA KATE I, MACKICHAN BLAIR N S;ASCAP
 ;916803083;DON'T GIVE UP (FEAT. SIA & BUSTA RHYMES);DA SILVA ANDRE MURILO, FURLER SIA KATE I, GRIGG ALLAN PETER, MENSAH VICTOR KWESI, PINHEIRO GODOY, SMITH TREVOR, SPIEGEL SAM;ASCAP
 ;916801294;DON'T GIVE UP (FEAT. SIA & BUSTA RHYMES) - SH;DA SILVA ANDRE MURILO, FURLER SIA KATE I, GRIGG ALLAN PETER, MENSAH VICTOR KWESI, PINHEIRO GODOY, SMITH TREVOR, SPIEGEL SAM;ASCAP
T0607502486;883896842;DON'T TRUST HIM;FRANK SAM, FURLER SIA KATE I;ASCAP
T0614614833;885978512;DOUBLE RAINBOW;FURLER SIA KATE I, KURSTIN GREGORY ALLEN, PERRY KATY;ASCAP
 ;341733753;DREAMING;BINNS HENRY DANIEL, FURLER SIA KATE I, HARDAKER SAM, UNCLAIMED WTR CHARE;ASCAP
T0615082115;887002188;DRESSED IN BLACK;FURLER SIA KATE I, KURSTIN GREGORY ALLEN, MICHAELS GRANT PHILLIP;ASCAP
T0605127432;640416002;DRINK TO GET DRUNK;FRANK SAMUEL JAMES, FURLER SIA KATE I;ASCAP
T0608463951;341740076;DUET;FURLER SIA KATE I, FURLER SIA KATE I, MENDEZ LESTER A, NOONAN KATIE ANNE;ASCAP
 ;342717359;DUET;FURLER SIA KATE I, MENDEZ LESTER, NOONAN KATIE ANNE;ASCAP
T9224448695;893195973;DUSK TILL DAWN;FURLER SIA KATE I, KURSTIN GREG, MALIK ZAIN JAVADD, ORIET ALEXANDER, PHELAN DAVID ANTHONY;ASCAP
 ;340939891;DUST;CAREY DANIEL DE MUSSENDEN, FURLER SIA KATE I;ASCAP
T3031248365;910935035;DYNAMITE;FURLER SIA KATE I, HENRIQUES SEAN PAUL, KURSTIN GREG, LODGE NYANN RAYMOND, RASTOGI YANNICK, RAYMOND ZACHARIE ALEXANDRE;ASCAP
T3090489746;914968259;DYNAMITE FEAT. SIA AND MISS LAFAMILIA (BANX &;BLAKE FARRA HEIDI MONICA O'HANLON DOUGLAS, FURLER SIA KATE I, HENRIQUES SEAN PAUL, KURSTIN GREG, LAYTON CHRISTOPHER JAMES OSBORN, LODGE NYANN RAYMOND, RASTOGI YANNICK, RAYMOND ZACHARIE ALEXANDRE;ASCAP
T0617936114;892886445;EASY;FURLER SIA KATE I, MCKENZIE TIMOTHY LEE;ASCAP
T9157738959;887809632;EASY STREET (2014 FILM VERSION);CHARNIN MARTIN, FURLER SIA KATE I, GLUCK WILLIAM, KURSTIN GREGORY ALLEN, STROUSE CHARLES;ASCAP
T9157738959;887896012;EASY STREET (2014 FILM VERSION);CHARNIN MARTIN, FURLER SIA KATE I, GLUCK WILLIAM, KURSTIN GREG, STROUSE CHARLES;ASCAP
 ;894207761;EKG;FURLER SIA KATE I, SHUCKBURGH ALEXANDER;ASCAP
T9106879747;917655314;ELASTIC HEART;FURLER SIA KATE I, PENTZ THOMAS WESLEY, SWANSON ANDREW FITZGERALD;ASCAP
T9106879747;885953600;ELASTIC HEART FEAT THE WEEKND & DIPLO;FURLER SIA KATE I, PENTZ THOMAS WESLEY, SWANSON ANDREW FITZGERALD, TESFAYE ABEL;ASCAP
T0609478401;351444430;ELECTRIC BIRD;BINNS HENRY DANIEL, FURLER SIA KATE I;ASCAP
T0607502497;883896840;EVER;FRANK SAM, FURLER SIA KATE I;ASCAP
T0608774533;351024714;EVERYDAY;FURLER SIA KATE I, MENDEZ LESTER A;ASCAP
T9231477808;893608140;EVERYDAY IS CHRISTMAS;FURLER SIA KATE I, KURSTIN GREG;ASCAP
T9288091054;897592927;EVERYDAY IS HALLOWEEN;DIXON SAMUEL RONALD, FURLER SIA KATE I, PIERSON KATE;ASCAP
 ;352185352;EVERYONE'S CHILD;CAREY DANIEL DE MUSSENDEN, FURLER SIA KATE I;ASCAP
 ;904102979;EVERYTHING YOU NEEDED;BRAIDE CHRISTOPHER, FURLER SIA KATE I;ASCAP
 ;350566435;EXISTED;CAREY DANIEL DE MUSSENDEN, FURLER SIA KATE I;ASCAP
T9149927399;888665758;EXPERTEASE (READY SET GO);FELDER WARREN, FURLER SIA KATE I, LOPEZ JENNIFER, MOSTYN STEVE, WANSEL ANDREW;ASCAP
T0614423801;887335225;EYE OF THE NEEDLE;BRAIDE CHRISTOPHER KENNETH, FURLER SIA KATE I;ASCAP
T0617935462;893195966;EYE TO EYE;FURLER SIA KATE I, SHATKIN JESSE SAMUEL;ASCAP
T0607667742;361142774;FACING AWAY;DIXON SAM, FURLER SIA KATE I, FURLER SIA KATE I;ASCAP
T9142657134;887002192;FAIR GAME;FURLER SIA KATE I, KURSTIN GREGORY ALLEN;ASCAP
T0605849828;883896837;FANCY ME?;FRANK SAM, FURLER SIA KATE I;ASCAP
T0605836596;917309950;FEAR;FURLER SIA KATE I;ASCAP
T0615081963;887015462;FIRE MEETS GASOLINE;DIXON SAMUEL RONALD, FURLER SIA KATE I, KURSTIN GREGORY ALLEN;ASCAP
T0616330494;889567822;FIRECRACKER;FURLER SIA KATE I, KURSTIN GREG;ASCAP
T9148139677;884337716;FIREFLY;FURLER SIA KATE I, MCALL BARNABY JOHNATHON, SLATER GIAN ELIZABETH;ASCAP
T0616538158;890049300;FIST FIGHTING A SANDSTORM;FURLER SIA KATE I, SHATKIN JESSE SAMUEL;ASCAP
T9190189754;887164136;FLASHLIGHT;FURLER SIA KATE I, GUZMAN CHRISTIAN NICOLAS, MOORE JASON, SMITH SAMUEL FREDERICK;ASCAP
T3031210392;910782281;FLOATING THROUGH SPACE;FURLER SIA KATE I, KURSTIN GREG;ASCAP
 ;361344770;FLOWERS;CAREY DANIEL DE MUSSENDEN, FURLER SIA KATE I;ASCAP
 ;361489418;FLOWERS;CAREY DANIEL DE MUSSENDEN, FURLER SIA KATE I;ASCAP
 ;883209278;FOLLOW ME;BINNS HENRY, FURLER SIA KATE I, MTUNGWASI ESKA;ASCAP
T9202117633;890020508;FOOTPRINTS;FURLER SIA KATE I, SEETHARAM NIKHIL SHANKER, VALLE JOSHUA, WILLIAMS TYLER MATHEW CARL;ASCAP
T0612708878;893069468;FREE ME;FURLER SIA KATE I, PIANE LUCIAN MICHAEL, PLANE LUCIAN;ASCAP
T0615082091;887002197;FREE THE ANIMAL;FURLER SIA KATE I, KURSTIN GREGORY ALLEN, LEAK JASPER MAXIMILLIAN;ASCAP
 ;895894020;GALAXY;ARSENAULT RENE, FURLER SIA KATE I, MOHLER BILLY;ASCAP
T0618919224;896012485;GALAXY;ARSENAULT RENE C, FURLER SIA KATE I, MOHLER WILLIAM JON;ASCAP
T0607667753;370924251;GARDEN;DIXON SAM, FURLER SIA KATE I, FURLER SIA KATE I;ASCAP
T0615971431;888878142;GASOLINE;BLAIR PAUL, FURLER SIA KATE I, MONSON NICK;ASCAP
T9243594594;894786683;GENIUS;FURLER SIA KATE I, MCKENZIE TIMOTHY LEE, MECKSEPER PHILIP, PENTZ THOMAS WESLEY;ASCAP
T9281550990;896767479;GENIUS (LIL WAYNE REMIX);CARTER DWAYNE, FURLER SIA KATE I, MCKENZIE TIMOTHY LEE, MECKSEPER PHILIP, PENTZ THOMAS WESLEY;ASCAP
T9103766241;885494709;GENTLEMEN;FURLER SIA KATE I, GAD TOBY;ASCAP
T9113432976;885955263;GET OVER YOU;FURLER SIA KATE I, HITCH NEON, LEVIN BENJAMIN JOSEPH;ASCAP
T3213840332;921879493;GIMME LOVE;FURLER SIA KATE I, SHATKIN JESSE SAMUEL;ASCAP
T0117274573;370558540;GIRL YOU LOST TO COCAINE;ALLUM ROBERT DOUGLAS, FURLER SIA KATE I, MARTEN PHILIP, MYER MATTHEW EDWARD TRISTRAM;ASCAP
T9220945766;892892424;GO GET IT;AJIBADE OLUWATOSIN, FURLER SIA KATE I, MECKSEPER PHILIP, PENTZ THOMAS WESLEY, PICARD CLEMENT MARIE JACQUES, PICARD MAXIME MARIE LAURENT;ASCAP
T3214726742;921885467;GO ON;FURLER SIA KATE I, HARRIS JASPER, HOIBERG MAGNUS, LEVIN BENJAMIN, SHATKIN JESSE SAMUEL;ASCAP
T0614707708;886331407;GOD MADE YOU BEAUTIFUL;BRAIDE CHRIS, FURLER SIA KATE I, KNOWLES BEYONCE GISSELLE;ASCAP
T9141351511;887335230;GODZILLIONAIRE;CANDY BROOKE, FURLER SIA KATE I, JOLIFF JIMMY, JOLLIFF JAMES T, SHATKIN JESSE SAMUEL;ASCAP
T9173881975;889489856;GOLDEN;FURLER SIA KATE I, MCCOY TRAVIS L, PENTZ THOMAS WESLEY, PICARD CLEMENT MARIE JACQUES, PICARD MAXIME MARIE LAURENT;ASCAP
T0617127453;891223709;GREATEST FEAT KENDRICK LAMAR;FURLER SIA KATE I, KENDRICK LAMAR, KURSTIN GREG, MACKICHAN BLAIR NICHOLAS SOMERLED;ASCAP
 ;885811521;GREEN CARD;FABRICIUS NANNA OLAND, FURLER SIA KATE I, MICHAELS GRANT;ASCAP
T0614761157;887887413;GREEN CARD;FABRICIUS NANNA OLAND, FURLER SIA KATE I, MICHAELS GRANT PHILLIP;ASCAP
T0614423425;885186031;GUITARS AND MICROPHONES;BRAIDE CHRISTOPHER KENNETH, FURLER SIA KATE I, PIERSON KATE;ASCAP
T0615198894;887185702;GUTS OVER FEAR;FURLER SIA KATE I, HAYNIE EMILE, HILL JOHN GRAHAM, MATHERS MARSHALL B, RESTO LUIS EDGARDO;ASCAP
T9170335474;888936483;HEAD HIGH;FURLER SIA KATE I, MECKSEPER PHILIP, PENTZ THOMAS WESLEY, SWANSON ANDREW FITZGERALD;ASCAP
T0606733394;883896833;HEALING IS DIFFICULT;FRANK SAM, FURLER SIA KATE I;ASCAP
T9296521943;898249749;HEART OF GLASS;FURLER SIA KATE I, KURSTIN GREG;ASCAP
T9283171517;896777886;HEAVEN CAN WAIT;FURLER SIA KATE I, MCKENZIE TIMOTHY LEE, MECKSEPER PHILIP, PENTZ THOMAS WESLEY;ASCAP
 ;887673442;HEAVENLY PINEAPPLE;AXELROD VICTOR, BRENNECK THOMAS, FURLER SIA KATE I, HILL JOHN GRAHAM, MOVSHON NICK, STEINWEISS HOMER;ASCAP
T3021152110;909999905;HEY BOY;FURLER SIA KATE I, PURCELL CAMILLE ANGELINA, SHATKIN JESSE SAMUEL;ASCAP
 ;910051938;HEY BOY (REMIX FT. BURNA BOY);FURLER SIA KATE I, OGULU DAMINI EBUNOLUWA, PURCELL CAMILLE, SHATKIN JESSE SAMUEL;ASCAP
 ;910755419;HEY BOY (REMIX);FURLER SIA KATE I, OGULU DAMINI EBUNOLUWA, PURCELL KAMILLE, SHATKIN JESSE SAMUEL;ASCAP
T9226414693;892675499;HEY HEY HEY;FURLER SIA KATE I, HUDSON SARAH THERESA, MAX MARTIN, PAYAMI ALI, PERRY KATY;ASCAP
T9231477706;893608133;HO HO HO;FURLER SIA KATE I, KURSTIN GREG;ASCAP
 ;381393251;HOLD ME DOWN;CAREY DANIEL DE MUSSENDEN, FURLER SIA KATE I;ASCAP
 ;381542910;HOLD ME DOWN;CAREY DANIEL DE MUSSENDEN, FURLER SIA KATE I;ASCAP
T0611875274;881114798;HOLD ON;FURLER SIA KATE I, MERCER CHRISTOPHER WILLIAM;ASCAP
 ;907998208;HOLD ON;FURLER SIA KATE I, MERCER;ASCAP
T9124310094;884057592;HOLOGRAM;FURLER SIA KATE I, GARIBAY FERNANDO;ASCAP
 ;889168170;HOME IS THE ENEMY;FURLER SIA KATE I, KRAUS OLIVER, LEAK JASPER;ASCAP
T9068232508;883425008;HOSTAGE;FURLER SIA KATE I, VALENSI NICK;ASCAP
T0616535853;890049306;HOUSE ON FIRE;ANTONOFF JACK MICHAEL, FURLER SIA KATE I;ASCAP
T9026694097;880388578;HURTING ME NOW;FURLER SIA KATE I, KURSTIN GREG;ASCAP
T0611563940;881250497;I AM;AGUILERA CHRISTINA, DIXON SAMUEL RONALD, FURLER SIA KATE I;ASCAP
T9171832909;883115062;I AM (STRIPPED);AGUILERA CHRISTINA, DIXON SAMUEL RONALD, FURLER SIA KATE I;ASCAP
T9299410212;905177071;I AM FOUND;DIXON SAM, FURLER SIA KATE I;ASCAP
 ;884664622;I AM ME;FUEGO, FURLER SIA KATE I, SMITH WILLOW CAMILLE;ASCAP
T0614423812;885186025;I CAN'T SLEEP / MUSTN'T THINK;BRAIDE CHRISTOPHER KENNETH, FURLER SIA KATE I;ASCAP
T9198905769;887809698;I DON T NEED ANYTHING BUT YOU 2014 FILM VERSI;CHARNIN MARTIN, FURLER SIA KATE I, GLUCK WILLIAM, KURSTIN GREGORY ALLEN, STROUSE CHARLES;ASCAP
T0608774544;883896856;I DON'T LOVE ME;FRANK SAM, FURLER SIA KATE I;ASCAP
T9159033666;887896011;I DON'T NEED ANYTHING BUT YOU (2014 FILM VERS;CHARNIN MARTIN, FURLER SIA KATE I, GLUCK WILLIAM, KURSTIN GREG, STROUSE CHARLES;ASCAP
 ;893608134;I FORGIVE YOU;FURLER SIA KATE I, KURSTIN GREG, REBILLAUD RENAUD, REBILLAUD RENAUD LOUIS REMI, WATI GANDHI DJUNA;ASCAP
T9124310118;884057594;I KEEP HOLDING ON;FURLER SIA KATE I, GARIBAY FERNANDO;ASCAP
T0613245194;884007169;I LOVE IT;FRANCIS BARRY JOHN M, FURLER SIA KATE I, LAMBERT MATTHEW DAVID, RANKINE DANIEL HENDLE, SMITH DANIEL HOWE;ASCAP
T0616573035;891107417;I LOVE IT RESTRUNG;FRANCIS BARRY JOHN M, FURLER SIA KATE I, LAMBERT MATTHEW DAVID, SMITH DANIEL HOWE;ASCAP
T0610946887;881101793;I M IN HERE;DIXON SAMUEL RONALD, FURLER SIA KATE I;ASCAP
T9268044048;895894019;I M STILL HERE;FURLER SIA KATE I, SHATKIN JESSE SAMUEL;ASCAP
T9159033622;887896008;I THINK I M GONNA LIKE IT HERE 2014 FILM VERS;CHARNIN MARTIN, FURLER SIA KATE I, GLUCK WILLIAM, KURSTIN GREGORY ALLEN, STROUSE CHARLES;ASCAP
T0612382678;885902453;I WILL GET OVER YOU;AHN PRISCILLA, FURLER SIA KATE I;ASCAP
T0608857437;392106399;IF I CAN'T HAVE YOU;BINNS HENRY DANIEL, FURLER SIA KATE I, HARDAKER SAM, MADDEN DAVID;ASCAP
T0614423823;885186026;IF YOU GO DOWN;BRAIDE CHRISTOPHER KENNETH, FURLER SIA KATE I;ASCAP
T0614761293;886106682;IF YOU SAY SO;BRAIDE CHRISTOPHER KENNETH, FURLER SIA KATE I, MICHELE LEA;ASCAP
T9100616599;885265615;ILLUMINATION (OUTRO);AUGELLO-COOK ALICIA J, FURLER SIA KATE I;ASCAP
T0606538082;883896830;I'M NOT IMPORTANT TO YOU;FRANK SAM, FURLER SIA KATE I;ASCAP
T9259221697;895150109;INCREDIBLE;FURLER SIA KATE I, MCKENZIE TIMOTHY LEE;ASCAP
T0617935542;892886535;INSECURE;FURLER SIA KATE I, MCKENZIE TIMOTHY LEE;ASCAP
T0606576902;883896838;INSIDIOUSLY;FRANK SAM, FURLER SIA KATE I;ASCAP
 ;393092474;INTERLUDES;FLAVELL JESSE, FURLER SIA KATE I;ASCAP
T0615485567;887559740;INVINCIBLE;FELDER WARREN OKAY, FURLER SIA KATE I, MOSTYN STEVE, SHATKIN JESSE SAMUEL;ASCAP
T0608774577;883896855;INVISIBLE;FRANK SAM, FURLER SIA KATE I;ASCAP
T9283171460;896776702;IT S TIME;FURLER SIA KATE I, MCKENZIE TIMOTHY LEE, PENTZ THOMAS WESLEY;ASCAP
T0608774588;883896851;I'VE BEEN STUNG;FRANK SAM, FURLER SIA KATE I;ASCAP
T9124310107;884057593;JACKET;FURLER SIA KATE I, GARIBAY FERNANDO;ASCAP
T9148156596;884348408;JAZZ EPIDURAL;FURLER SIA KATE I, MCALL BARNABY JOHNATHON;ASCAP
T0608774599;400580092;JAZZ HANDS;FURLER SIA KATE I, MACKICHAN BLAIR NICHOLAS SOMERLED;ASCAP
T0616861256;890185405;JE TE PARDONNE;DIALLO ADAMA MICKAEL, DJUNA GANDHI, FALL KARIM, FURLER SIA KATE I, REBILLAUD RENAUD LOUIS REMI;ASCAP
T0617231363;891470201;JESUS WEPT;DIXON SAMUEL RONALD, FURLER SIA KATE I;ASCAP
T0606643053;883896835;JUDGE ME;FRANK SAM, FURLER SIA KATE I;ASCAP
T9103864295;885186029;KILL AND RUN;BRAIDE CHRISTOPHER KENNETH, FURLER SIA KATE I;ASCAP
T9099994408;884772754;KILL FUCK MARRY;ERIKSEN MIKKEL STORLEER, FURLER SIA KATE I, HERMANSEN TOR ERIK;ASCAP
T3083062419;886396480;KISS ME ONCE;FURLER SIA KATE I, LEROY KOEN WIM, SHATKIN JESSE SAMUEL, SVENDSEN RONNY VIDAR, WIK ANNE JUDITH;ASCAP
T0608774602;914566062;KISS MYSELF ALL OVER;FURLER SIA KATE I, HARWOOD MICHAEL STEWART, PRIESTMAN HENRY CHRISTIAN DENT;ASCAP
T9244955224;888531626;KISS OF DEATH;FURLER SIA KATE I, GUETTA PIERRE DAVID, ROTTEVEEL NICK, TUINFORT GIORGIO HESDEY, WATTUM VAN MARCUS C;ASCAP
T0613852020;884734848;LAYING DOWN;FURLER SIA KATE I, GUETTA DAVID, TUINFORT GIORGIO H;ASCAP
T0607667764;421490775;LEAVE NOW;DIXON SAM, FURLER SIA KATE I, FURLER SIA KATE I;ASCAP
T0608223148;421760714;LENTIL;DIXON SAMUEL RONALD, FURLER SIA KATE I;ASCAP
T0613922841;884470379;LET ME LOVE YOU (UNTIL YOU LEARN TO LOVE YOUR;DI SCALA MICHAEL PASQUALE, ERIKSEN MIKKEL STORLEER, FURLER SIA KATE I, HADFIELD MARK PAUL, HERMANSEN TOR ERIK, SMITH SHAFFER;ASCAP
T3022987340;909556815;LET S LOVE;FURLER SIA KATE I, GUETTA PIERRE DAVID, TUINFORT GIORGIO H, UNKNOWN WRITER, WATTUM VAN MARCUS C;ASCAP
T9161770009;888226444;LET YOUR TEARS FALL;FURLER SIA KATE I, KURSTIN GREGORY ALLEN;ASCAP
 ;921879241;LET'S LOVE;FURLER SIA KATE I, GUETTA PIERRE DAVID, TUINFORT GIORGIO H, WATTUM VAN MARCUS C;ASCAP
T9231477740;893608135;LIE TO ME;FURLER SIA KATE I, SHATKIN JESSE SAMUEL;ASCAP
T9124301231;884030963;LIFE JACKET;FURLER SIA KATE I, GARIBAY FERNANDO;ASCAP
