ISWC;workId;title;creators;source
T9280885043;896599403;LIGHT HEADED - DAVID GUETTA & SIA;AL FAKIR SALEM LARS, BRAIDE CHRIS, DAENEN BORIS PIETER S, ERIKSEN MIKKEL STORLEER, FURLER SIA KATE I, GUETTA DAVID, HERMANSEN TOR ERIK, PONTARE VINCENT, PONTARE VINCENT FRED;ASCAP
T0615101308;887049329;LIGHTHEADED;FURLER SIA KATE I, KARLSSON CHRISTIAN LARS, KURSTIN GREG, LIDEHALL MAGNUS CARL ERIK, PONTARE VINCENT FRED;ASCAP
T3114302915;917164602;LIKE WATER;BATSON MARK, FURLER SIA KATE I, KEYS ALICIA;ASCAP
T3082531435;914378118;LIKE WATER (ORIGINALS);AUGELLO-COOK ALICIA J, BATSON MARK, FURLER SIA KATE I;ASCAP
T3014782226;905660147;LIKE YOU PIANO;FURLER SIA KATE I, MICHAEL GRANT;ASCAP
T9264845172;895803631;LIMITLESS;FURLER SIA KATE I, SHATKIN JESSE SAMUEL;ASCAP
 ;907295672;LISTENIN CONTINOUS MIX;AL SARRAF OSSAMA, ANTHONY MICHAEL, ATWEH NASRI TONY, BERGLING TIM, BONO SONNY, BRUNILA TEEMU WILLIAM, BUDHAI ALBERT M S, DAVEY JUSTIN HARLEIGH, DEAN ESTER, DERY VINCENT, DOUGLAS SEAN MAXWELL, DRAGSTREM MATTHEW PETERS, EARLEY GEOFFREY PATRICK, EINZIGER MICHAEL AARON, EVIGAN JASON GREGORY, FOREMAN DARREN, FRANKS JUSTIN SCOTT, FROST JULIE R, FURLER SIA KATE I, GARRITSEN MARTIJN G, GRAHAM EBOW, GUETTA PIERRE DAVID, ISAAC BREYAN STANLEY, JANSSEN SJOERD, JANSSEN WOUTER, JAYMES YOUNG, KARAGIORGOS VICKY, KARLSSON CHRISTIAN LARS, KARYOTAKIS CHRISTOPHER JAMES, LEITHEAD DOCHERTY THOMAS MARTIN, LIDEHALL MAGNUS CARL ERIK, LOMAX ALAN, LUKAS (DE 2), MAJIC DANIEL MIJO, MARAJ ONIKA TANYA, MARTIN SAMUEL DENISON, MUKHI PAVAN ANIL, PELLIZZER MARK RICHARD, PONTARE VINCENT FRED, REUTER MANUEL, REXHA BEBE, RIESTERER FREDERIC JEAN, RIOUX PIERRE LUC, ROBBINS LINDY, ROTH DAVID LEE, ROTTEVEEL NICK, SEREBA NICOLAY, SHEPARD NED TANNER, TEDDER RYAN B, TUINFORT GIORGIO H, TURPIN NICK ALAN, VAN DEN BOGAERDE JASMINE LUCILLA ELISABETH, VAN HALEN ALEX, VAN HALEN EDWARD, VYAS VINAY V, WALL VAN DE NICK L, WATTUM VAN MARCUS C, WEGNER RALPH;ASCAP
T0608218503;421756498;LITTLE BLACK SANDALS;CAREY DANIEL DE MUSSENDEN, FURLER SIA KATE I;ASCAP
T9157738813;887809827;LITTLE GIRLS (2014 FILM VERSION);CHARNIN MARTIN, FURLER SIA KATE I, GLUCK WILLIAM, KURSTIN GREGORY ALLEN, STROUSE CHARLES;ASCAP
T0606082874;887164066;LITTLE MAN (RS4 RADIO MIX);FRANK SAM, FURLER SIA KATE I;ASCAP
T0608599978;421377675;LIVING DOLL;FURLER SIA KATE I, KURSTIN GREG;ASCAP
T0616043889;888900645;LIVING OUT LOUD;EARLEY GEOFFREY PATRICK, FURLER SIA KATE I, HAMILTON PRISCILLA RENEA, KURSTIN GREG;ASCAP
T9282664679;897122183;LOOK UP;FURLER SIA KATE I, KURSTIN GREGORY ALLEN, MOORE ALECIA B;ASCAP
T0609408414;422552616;LOSING YOU;FURLER SIA KATE I, HARRY JAMES;ASCAP
T9149757777;886782072;LOVE IS A LEAP OF FAITH;FEEMSTER THERON OTIS, FURLER SIA KATE I, HASSON ISAAC R;ASCAP
 ;894062322;LOVE IS A LEAP OF FAITH (ORIGINAL VERSION);FEEMSTER THERON, FURLER SIA KATE I;ASCAP
T9098390137;884413765;LOVED ME BACK TO LIFE;FURLER SIA KATE I, HUSSAIN HASHAM S, MOTES DENARIUS;ASCAP
T0607667775;422789479;LULLABY;DIXON SAMUEL RONALD, FURLER SIA KATE I;ASCAP
T0603129367;917286562;MAD LOVE;FURLER SIA KATE I;ASCAP
T9236608369;894137418;MAGIC;FURLER SIA KATE I, SHATKIN JESSE SAMUEL;ASCAP
 ;893195972;MAGICAL;BRAIDE CHRISTOPHER, FURLER SIA KATE I;ASCAP
T9162701271;888227388;MAGNIFY MY LOVE;BALL FREDRIK WILLIAM, FURLER SIA KATE I;ASCAP
T0611979737;904818237;MAKE IT THROUGH THE NIGHT;CAREY DANIEL DE MUSSENDEN, FURLER SIA KATE I;ASCAP
T9176456567;886043893;MAKING THE MOST OF THE NIGHT;DIXON SAMUEL RONALD, FURLER SIA KATE I, HAIM ALANA MYCHAL, HAIM DANIELLE SARI, HAIM ESTE ARIELLE, JEPSEN CARLY RAE, RAMAZANOGLU EMRE;ASCAP
T0610946898;905211262;MARCELLE;BINNS HENRY, FURLER SIA KATE I;ASCAP
T0615418422;887926663;MATRIX;DIXON SAMUEL RONALD, FURLER SIA KATE I;ASCAP
 ;921241311;MAYBE;FURLER SIA KATE I, GUZMAN CHRISTIAN NICOLAS, MEJI MARIO, MOORE JASON, SMITH SAMUEL FREDERICK;ASCAP
T9202764587;891538078;MEIN LIEBLINGSFERD;FURLER SIA KATE I, KURSTIN GREG;ASCAP
T9231477762;893608136;MIRACLE;FURLER SIA KATE I, SHATKIN JESSE SAMUEL;ASCAP
T3041034173;431670150;MISTAKES (HILLS & PEAKS);DIXON SAM, DIXON SAMUEL RONALD, FURLER SIA KATE I;ASCAP
 ;887185602;MISTER SISTER;FURLER SIA KATE I, PIERSON KATE, VALENSI NICK;ASCAP
T0607351836;431434432;MOON;DIXON SAMUEL RONALD, FURLER SIA KATE I, HOGARTH JAMES DEARNESS;ASCAP
T0615585675;887865368;MOONQUAKE LAKE;FURLER SIA KATE I, GLUCK WILLIAM, KURSTIN GREG;ASCAP
T9206247372;911106075;MORE THAN YOU ASKED FOR;BRAIDE CHRISTOPHER KENNETH, FURLER SIA KATE I;ASCAP
T0617935780;892886357;MOUNTAINS;FURLER SIA KATE I, MCKENZIE TIMOTHY LEE, PENTZ THOMAS WESLEY;ASCAP
T0616535922;890049304;MOVE YOUR BODY;FURLER SIA KATE I, KURSTIN GREG;ASCAP
 ;919815261;MUDDY FEET;BOURELLY BADRIIA INES, CYRUS MILEY RAY, FRANK DAVID MARTIN, FURLER SIA KATE I, HEIN GREGORY ALDAE, KIPNER STEPHEN ALAN, POLLACK MICHAEL ROSS, SHATKIN JESSE SAMUEL, SHEYNE PAMELA EILEEN, WILLIAMS MICHAEL LEN, ZWIFFA;ASCAP
T0614423834;885186028;MUSIC;BRAIDE CHRISTOPHER KENNETH, FURLER SIA KATE I;ASCAP
T9150833413;904129386;MY GALAXY;ARSENAULT RENE C, FURLER SIA KATE I, MOHLER BILLY;ASCAP
T9152638136;887602122;MY HEART IS OPEN;FURLER SIA KATE I, JERKINS RODNEY ROY, LEVIN BENJAMIN JOSEPH, LEVINE ADAM NOAH, LINDAL ANDRE;ASCAP
T0611601978;881955057;MY LOVE;FURLER SIA KATE I, KRAUS OLIVER;ASCAP
T9238413495;894286342;MY OLD SANTA CLAUS;FURLER SIA KATE I, KURSTIN GREG;ASCAP
 ;897432675;NAR HJARTAN BRISTER;BRAIDE CHRISTOPHER, FURLER SIA KATE I;ASCAP
T0606945383;441107839;NATALES SONG;DIXON SAMUEL RONALD, FURLER SIA KATE I;ASCAP
T3141758949;918978743;NAUGHTY & NICE;FURLER SIA KATE I, SHATKIN JESSE SAMUEL;ASCAP
T0617337402;891879464;NEVER GIVE UP;FURLER SIA KATE I, KURSTIN GREG;ASCAP
T9026694100;880388579;NEVER GONNA LEAVE ME;FURLER SIA KATE I, KURSTIN GREG;ASCAP
T3065631978;441081992;NEWCLOUD;DIXON SAM, DIXON SAMUEL RONALD, FURLER SIA KATE I;ASCAP
T3079555623;441082017;NEWDISHWATER;DIXON SAM, DIXON SAMUEL RONALD, FURLER SIA KATE I;ASCAP
T3052868272;441082035;NEWSILENCE;DIXON SAM, DIXON SAMUEL RONALD, FURLER SIA KATE I;ASCAP
T9283171471;896749515;NO NEW FRIENDS;ALLEN HENRY AGINCOURT, FURLER SIA KATE I, MCKENZIE TIMOTHY LEE, MECKSEPER PHILIP, PENTZ THOMAS WESLEY;ASCAP
T9001879330;441231258;NORMAL IS A RUMOUR;FURLER SIA KATE I, HOWARD FELIX STARBUCK, MCMILLAN JAMES;ASCAP
T0607248203;740411569;NUMB;FURLER SIA KATE I, HOWARD FELIX STARBUCK, MCMILLAN JAMES LOY;ASCAP
T0616719824;889700222;OASIS;CORRALIZA IVAN, FURLER SIA KATE I, GORVELL-DAHLL KYRRE, RUDOLF KEVIN;ASCAP
 ;891538076;OASIS FT. SIA;CORRALIZA IVAN, FURLER SIA KATE I, RUDOLF KEVIN;ASCAP
T0618399624;893608137;OBLIVION;FURLER SIA KATE I, LABRINTH;ASCAP
T9221566321;892936969;OH BODY;FURLER SIA KATE I, GARCIA AMERICO JULIO, PENTZ THOMAS WESLEY;ASCAP
T9174814530;889292309;OH BOY;FURLER SIA KATE I, GARCIA AMERICO, MEJIA JULIO ALEJANDRO, PENTZ THOMAS WESLEY, TOTH MATTHEW VAN;ASCAP
T0607667797;450802874;OLD NOISES;FURLER SIA KATE I, FURLER SIA KATE I, MADDEN DEDI;ASCAP
T9172261573;889068701;ONE CANDLE;FURLER SIA KATE I, RALPH JOSHUA;ASCAP
T0616536050;890049301;ONE MILLION BULLETS;FURLER SIA KATE I, SHATKIN JESSE SAMUEL;ASCAP
T0615585664;888020137;OPPORTUNITY;FURLER SIA KATE I, FURLER SIA KATE I, GLUCK WILLIAM, KURSTIN GREG;ASCAP
T9154518577;886804111;OPULENCE;BERESIN NOAH LEV, CANDY BROOKE, FURLER SIA KATE I, GELLER JESSE ST JOHN, PENTZ THOMAS WESLEY, SAFFORD JORDAN RICHARD ROSS;ASCAP
 ;889472496;OPULENCE (CORY ENEMY REMIX);BERESIN NOAH LEV, CANDY BROOKE DYAN, FURLER SIA KATE I, PENTZ THOMAS WESLEY, SAFFORD JORDAN RICHARD ROSS, ST JOHN JESSE;ASCAP
T9313582944;906513892;ORIGINAL;DOUGLAS SEAN, DOUGLAS SEAN MAXWELL, FURLER SIA KATE I, SHATKIN JESSE SAMUEL;ASCAP
T9313582944;909061259;ORIGINAL;DOUGLAS SEAN MAXWELL, FURLER SIA KATE I, SHATKIN JESSE SAMUEL;ASCAP
T9313582944;912984419;ORIGINAL;DOUGLAS SEAN MAXWELL, FURLER SIA KATE I, SHATKIN JESSE SAMUEL;ASCAP
 ;450548211;OTHER;CAREY DANIEL DE MUSSENDEN, FURLER SIA KATE I;ASCAP
T9299752446;905675159;OUT THERE;BRAIDE CHRISTOPHER KENNETH, CHRISTIE ANDREW JAMES, EMANUEL RUSSELL JASON, FURLER SIA KATE I, KOFSKY STEVEN, ZIMMER HANS FLORIAN;ASCAP
 ;461662899;PAGEANT OF THE BIZARRE;BINNS HENRY, FURLER SIA KATE I, HARDAKER SAM;ASCAP
T0615428006;887223309;PAPER TIGER;FURLER SIA KATE I, SHATKIN JESSE SAMUEL;ASCAP
T9173391805;889202199;PARTY CANDY;FURLER SIA KATE I, MCCOY TRAVIS L, SHUCKBURGH ALEXANDER WILLIAM;ASCAP
T9150173878;886172329;PASSENGERS;FURLER SIA KATE I, PENTZ THOMAS WESLEY, PERRY KATY, SWANSON ANDREW FITZGERALD;ASCAP
T9169991440;888954066;PERFECT;FURLER SIA KATE I, WHITE FRANCIS ANTHONY;ASCAP
T3083354643;885915772;PERFUME;BRAIDE CHRIS, FURLER SIA KATE I;ASCAP
T9133749458;887084615;PERFUME (THE DREAMING MIX);BRAIDE CHRISTOPHER KENNETH, FURLER SIA KATE I, SPEARS BRITNEY;ASCAP
T0608218865;461753139;PICTURES;CAREY DANIEL DE MUSSENDEN, FURLER SIA KATE I;ASCAP
T3081722018;914314316;PIN DROP;FURLER SIA KATE I, SHATKIN JESSE SAMUEL;ASCAP
T0608774624;883896853;PISS & RUBBER;FRANK SAM, FURLER SIA KATE I;ASCAP
T9194449779;890640167;PITCH PERFECT 2;FURLER SIA KATE I, GUZMAN CHRISTIAN NICOLAS, MOORE JASON, SMITH SAMUEL FREDERICK;ASCAP
 ;891013858;PITCH PERFECT 2;FURLER SIA KATE I, GUZMAN CHRISTIAN, MOORE JASON, SMITH SAMUEL;ASCAP
 ;895849082;PITCH PERFECT FRANCHISE MEDLEY;BARLETTA GINO MAURICE, BRUZENAK SCOTT, CAMPBELLE MIKE, CARTER ALVIN PLEASANT, DEAN DEANDRIA RONAY, DEAN ESTHER, FORSEY KEITH, FURLER SIA KATE I, GERSTEIN VALLEJO LUISA AMANDA, GUZMAN CHRISTIAN NICOLAS, MASON HARVEY JAY, MOORE JASON, NEWBILL MATTHEW BRITTEN, SANDERSON JAMIE MICHAEL ROBERT, SCHIFF STEVE W, SMITH SAMUEL, TUNSTALL-BEHRENS HELOISE;ASCAP
 ;461201396;PLASTER;FURLER SIA KATE I, TRACK & FIELD;ASCAP
T3042058420;911414259;PLAY DUMB;ANTONOFF JACK, FURLER SIA KATE I;ASCAP
T9150274207;462385213;PLAYGROUND;BLOXSOM FELIX, DIXON SAMUEL RONALD, FURLER SIA KATE I;ASCAP
 ;887073822;POP ROCK;FURLER SIA KATE I, TAYLOR ROBERT SHEA;ASCAP
T0615101228;887835609;POP ROCK;FURLER SIA KATE I, TAYLOR ROBERT SHEA;ASCAP
T0614217252;886345303;PRETTY HURTS;COLEMAN JOSHUA EMANUEL, FURLER SIA KATE I, KNOWLES BEYONCE GISSELLE;ASCAP
T0618560283;891570404;PRISONER;FURLER SIA KATE I, GLASS JACK, STRACEY CHRISTOPHER JOHN;ASCAP
T9249494653;895066609;PRIVATE GIRL;ERIKSEN MIKKEL STORLEER, FURLER SIA KATE I, HERMANSEN TOR ERIK;ASCAP
T0615428040;888122431;PULLS YOU UNDER;AUSTIN DALLAS, FURLER SIA KATE I, PIERSON KATE;ASCAP
 ;885049957;PUPPET STRINGS;AHLUND JOAKIM FRANS, FURLER SIA KATE I, STONE OLLIE;ASCAP
T9231477842;893608142;PUPPIES ARE FOREVER;FURLER SIA KATE I, KURSTIN GREG;ASCAP
T0617698824;892515443;QUIT;FURLER SIA KATE I, GRANDE ARIANA, HOEIBERG MAGNUS, LEVIN BENJAMIN JOSEPH, ROMANO FRANK;ASCAP
T9127289445;884411414;RADIO ACTIVE;FURLER SIA KATE I, KURSTIN GREGORY ALLEN;ASCAP
T0618086693;893399639;RAINBOW;FURLER SIA KATE I, NOTORLEVA JAMES VINCENT, SHATKIN JESSE SAMUEL;ASCAP
T0616623676;890185412;REAPER;FURLER SIA KATE I, GOLDSTEIN NOAH D, LOPEZ DOMINIC HALAAPIAPI, NJAPA CHARLES MISODI, WEST KANYE;ASCAP
 ;481133315;RED HANDED;CAREY DANIEL DE MUSSENDEN, FURLER SIA KATE I;ASCAP
 ;481253918;RED HANDED;CAREY DANIEL DE MUSSENDEN, FURLER SIA KATE I;ASCAP
 ;912841621;RESPIRO;ADKINS ADELE, FURLER SIA KATE I, JESSO JR TOBIAS;ASCAP
T0606832932;480939135;REWRITE;DIXON SAMUEL RONALD, FURLER SIA KATE I;ASCAP
T3016830067;909003746;RIDING ON MY BIKE;FURLER SIA KATE I, GOLDINGS LAWRENCE S;ASCAP
 ;905823514;RIFF OFF;ANDREWS MARK A, BRITTEN TERENCE ERNEST, CARLTON VANESSA, CASEY HARRY WAYNE, CHILD DESMOND, COLLINS MARQUIS T, CORBITT JERRY BYRON, DILLARD TRAMAR LACEL, FAREED KAMAAL IBN JOHN, FINCH RICK, FREEZE LOUIS M, FURLER SIA KATE I, FUSARI ROBERT D, GUZMAN CHRISTIAN NICOLAS, HIGGINS BRYAN, HILL LAURYN N, HUMPHREY MONTAY DESMOND, JACKSON JAMES, JORDAN MONTELL DU'SEAN, KEAR JOSH, KELLEY TIM, KNOWLES BEYONCE GISSELLE, LONGO JOSEPH PAUL, LYLE GRAHAM HAMILTON, MOORE FALONTE D, MOORE JASON, MUGGERUD LARRY E, MUHAMMAD ALI SHAHEED, NAJM FAHEEM, NICHOLS TIM J, NICKS STEVIE, PIERCE OJI, RAY ANTHONY L, REYES SENEN, ROBERSON KOREY, ROBINSON BOB, ROSA DRACO CORNELIUS, SANDBERG MARTIN KARL, SCHUSTER JOHAN, SIMMONS HOWARD M, SMITH SAMSON COSRAY, SMITH TREVOR, STRAITE ELLIOTT T, SWIFT TAYLOR, TAYLOR MALIK IZAAK, TOMPKINS CHRISTOPHER G, WALTERS RICKY M L, WISEMAN CRAIG MICHAEL;ASCAP
T9103920236;885469725;RISE UP;FURLER SIA KATE I, HOLLIS CHAUNCEY ALEXANDER, KNOWLES BEYONCE GISSELLE, WOODARD JESSE;ASCAP
T9103920236;907186181;RISE UP;FURLER SIA KATE I, HOLLIS CHAUNCEY, KNOWLES BEYONCE GISSELLE, WOODARD JESSE;ASCAP
T9103920236;913520925;RISE UP;FURLER SIA KATE I, HOLLIS CHAUNCEY, KNOWLES BEYONCE GISSELLE, WOODARD IV JESSE;ASCAP
T0617037872;883736579;ROUND YOUR LITTLE FINGER;BRAIDE CHRIS, FURLER SIA KATE I, MCPHEE KATHERINE;ASCAP
T0610946912;904130604;RULES ARE FOR BREAKING;DIXON SAMUEL RONALD, FURLER SIA KATE I;ASCAP
T0615391519;887455604;RUN FOR YOUR LIFE;FURLER SIA KATE I, SHATKIN JESSE SAMUEL;ASCAP
T0607667800;492861795;SALTED WOUND;DIXON SAM, FURLER SIA KATE I, FURLER SIA KATE I;ASCAP
T0615633301;887866081;SALTED WOUND;EATON GERALD JOHN DAVID, FURLER SIA KATE I, KRAUS OLIVER, WEST BRIAN;ASCAP
T9231477433;893608114;SANTA S COMING FOR US;FURLER SIA KATE I, KURSTIN GREG;ASCAP
T3081735420;914314433;SANTA VISITS EVERYONE;FURLER SIA KATE I, SHATKIN JESSE SAMUEL;ASCAP
T9324678628;907754883;SAVED MY LIFE;FURLER SIA KATE I, KURSTIN GREGORY ALLEN, LIPA DUA;ASCAP
T0607304540;493363456;SEA SHELLS;FURLER SIA KATE I, GOLDINGS LAWRENCE S;ASCAP
 ;495501034;SET YOU ON A CLOUD;DOHERTY ROYCE ALAN M, FURLER SIA KATE I;ASCAP
T9158142064;889059564;SEXERCISE;COFFEE, FURLER SIA KATE I, JOHNSON JORDAN KENDALL, JOHNSON STEFAN ADAM, LOMAX MARCUS DURAND, TAHRIRI SOGOL NELLA;ASCAP
T9153474501;886512051;SEXERCIZE;COFFEE CLARENCE BERNARD, FURLER SIA KATE I, JOHNSON JORDAN KENDALL, JOHNSON STEFAN ADAM, LOMAX MARCUS DURAND, TAHRIRI SOGOL NELLA;ASCAP
T0613644862;493841251;SHAME;FURLER SIA KATE I, JULES GARY;ASCAP
 ;491949292;SHE KNOWS;CAREY DANIEL DE MUSSENDEN, FURLER SIA KATE I;ASCAP
T0613648386;884474311;SHE WOLF FALLING TO PIECES;BRAIDE CHRIS, FURLER SIA KATE I, GUETTA DAVID, TUINFORT GIORGIO H;ASCAP
T3045067894;911757145;SHINE BRIGHT;ERIKSEN MIKKEL STORLEER, FURLER SIA KATE I, HERMANSEN TOR ERIK, LEVIN BENJAMIN;ASCAP
T0614761146;905363075;SIA;CORBY MATT JOHN, FURLER SIA KATE I;ASCAP
 ;906338212;SIA MEDLEY;FURLER SIA KATE I, KIM ANDREWS JOHN;ASCAP
T0608774646;493841297;SICK FLOWERS;CAREY DANIEL DE MUSSENDEN, FURLER SIA KATE I;ASCAP
T0607667811;492861777;SILENCE;DIXON SAM, FURLER SIA KATE I, FURLER SIA KATE I;ASCAP
T9271385263;896175202;SING FOR MY LIFE;FURLER SIA KATE I, KURSTIN GREG;ASCAP
T9299866890;905695481;SING PRAISES UNTO GOD;FURLER SIA KATE I, PENTZ THOMAS WESLEY, SWANSON ANDREW FITZGERALD;ASCAP
T9206247372;891879462;SKELETONS;BRAIDE CHRISTOPHER KENNETH, FURLER SIA KATE I;ASCAP
T0615437701;887223411;SLEDGEHAMMER;FENTY ROBYN, FURLER SIA KATE I, SHATKIN JESSE SAMUEL;ASCAP
 ;495501338;SLIP INTO YOU;DOHERTY ROYCE ALAN M, FURLER SIA KATE I;ASCAP
T9231477864;893608143;SNOWFLAKE;FURLER SIA KATE I, KURSTIN GREG;ASCAP
T9231477820;893608141;SNOWMAN;FURLER SIA KATE I, KURSTIN GREG;ASCAP
T0616484242;889820963;SOC DE TITANI;FURLER SIA KATE I, GUETTA PIERRE DAVID, TUINFORT GIORGIO H, WALL VAN DE NICK L;ASCAP
T0606864349;492191974;SOMERSAULT;BINNS HENRY DANIEL, FURLER SIA KATE I, HARDAKER SAM;ASCAP
 ;892527754;SOWSH;BINNS HENRY, FURLER SIA KATE I, HARDAKER SAM;ASCAP
T0607152124;492166233;SPEED DIAL;BINNS HENRY, FURLER SIA KATE I, HARDAKER SAM;ASCAP
T9330537183;492096514;SPEED DIAL NO 2;BINNS HENRY DANIEL, FURLER SIA KATE I, HARDAKER SAM;ASCAP
T9102495125;886510838;STANDING ON THE SUN;FURLER SIA KATE I, KNOWLES BEYONCE GISSELLE, KURSTIN GREGORY ALLEN, PROCTOR ANDRE ERIC;ASCAP
T9183275481;889945936;STAR SPANGLED LOVE;ERIKSEN MIKKEL STORLEER, FURLER SIA KATE I, HERMANSEN TOR ERIK;ASCAP
T0615101319;887049306;STRAIGHT FOR THE KNIFE;FURLER SIA KATE I, PARKER JUSTIN;ASCAP
 ;884658268;STRAIGHT JACKET;FURLER SIA KATE I, WILHELM SANDY JULIEN;ASCAP
T0614345093;885645797;STRANGE BIRDS;FURLER SIA KATE I, RECHTSHAID ARIEL ZVI, VAN DEN BOGAERDE JASMINE LUCILLA ELISABETH;ASCAP
 ;493841279;STRANGER MAN;ALLUM ROBERT DOUGLAS, FURLER SIA KATE I, MARTIN PHIL, MYER MATTHEW EDWARD TRISTRAM;ASCAP
T0611563962;881250500;STRONGER THAN EVER;AGUILERA CHRISTINA, DIXON SAMUEL RONALD, FURLER SIA KATE I;ASCAP
T0617074528;890840977;SUFFERING;FURLER SIA KATE I, LEAK JASPER MAXIMILLIAN;ASCAP
T0615437745;887223419;SUMMER RAIN;FURLER SIA KATE I, SHATKIN JESSE SAMUEL;ASCAP
T0606765405;492106799;SUNDAY;DIXON SAMUEL RONALD, FURLER SIA KATE I;ASCAP
T9231477875;893608144;SUNSHINE;FURLER SIA KATE I, KURSTIN GREG;ASCAP
T0617935553;892515630;SURE OF MYSELF;FURLER SIA KATE I, MENDES SHAWN;ASCAP
T9239571778;894109491;SWEAT AND TEARS;FURLER SIA KATE I, TROTH JACOB MICHAEL;ASCAP
T0616538227;890049319;SWEET DESIGN;ANDREWS MARK A, CHILD DESMOND, COLLINS MARQUIS T, FURLER SIA KATE I, KELLEY TIM, KURSTIN GREG, LONGO JOSEPH PAUL, ROBINSON BOB H, ROSA ROBI;ASCAP
 ;493841313;SWEET ONE;FURLER SIA KATE I, MENDEZ LESTER A, NOONAN KATIE;ASCAP
T0608774384;495501614;SWEET ONE;FURLER SIA KATE I, MENDEZ LESTER, NOONAN KATIE ANNE;ASCAP
T0607393816;492441051;SWEET POTATO;CORMACK KEVIN JAMES, FURLER SIA KATE I, HOGARTH JAMES DEARNESS;ASCAP
T0607393816;496170891;SWEET POTATO;CORMACK KEVIN JAMES, FURLER SIA KATE I, HOGARTH JAMES DEARNESS;ASCAP
 ;888936808;TAKE U THERE ZEDS DEAD REMIX;BERESIN NOAH LEV, CANDY BROOKE, FURLER SIA KATE I, GELLER JESSE ST JOHN, PENTZ THOMAS WESLEY, STAFFORD JORDAN;ASCAP
 ;800643847;TAKEN FOR GRANTED;CORSBIE NIGEL BRUCE, FURLER SIA KATE I;ASCAP
T9138828203;886600800;TEARS FALL;COLEMAN JEREMY MICHAEL, FURLER SIA KATE I, RAY LINDSEY, WITHERSPOON RICK TYRONE;ASCAP
T9180502765;889756723;TELEPATHY;ERIKSEN MIKKEL STORLEER, FURLER SIA KATE I, HERMANSEN TOR ERIK;ASCAP
T0612695165;883209293;TELL ME;BINNS HENRY, FURLER SIA KATE I;ASCAP
 ;895001026;TEXT ME BACK;FURLER SIA KATE I, MCALL BARNEY, MITCHELL SARA ELIZABETH, VAZQUEZ VICTOR;ASCAP
T0607502500;883896841;THANK YOU;FRANK SAM, FURLER SIA KATE I;ASCAP
T9288023870;897564940;THAT S LIFE;ASHFORD NICKOLAS, FURLER SIA KATE I, GLOGOWER DANIEL C., GOULD ANDREW DAVID, LAVALLE MICHAEL LOREN, MC CORMICK MALCOLM JAMES, NELSON WINSTON D ADRIAN, NJAPA CHARLES MISODI, O CONNELL JAMES MICHAEL, ROSENBERG IVAN JACKSON, SIMPSON VALERIE;ASCAP
T0606945372;502282971;THE CHURCH OF WHAT'S HAPPENING NOW;DIXON SAMUEL RONALD, FURLER SIA KATE I;ASCAP
T9153976013;888394802;THE CITY IS YOURS;ERIKSEN MIKKEL STORLEER, FURLER SIA KATE I, GLUCK WILLIAM, HERMANSEN TOR ERIK, LEVIN BENJAMIN JOSEPH;ASCAP
T9116595654;883940622;THE CONVERSATION 1;FURLER SIA KATE I, VALENSI NICK;ASCAP
T9126098473;884332052;THE CONVERSATION CUES;FURLER SIA KATE I, VALENSI NICK;ASCAP
T0607403315;502137075;THE CORNER;FURLER SIA KATE I, KURSTIN GREG;ASCAP
T0610770961;506150016;THE FIGHT;CAREY DANIEL DE MUSSENDEN, FURLER SIA KATE I;ASCAP
T9183463447;886761377;THE GAME;DOCKERY KIRBY LAURYEN, FURLER SIA KATE I, TROTH JAKE;ASCAP
 ;503249854;THE GIRL YOU LOST TO COCAINE;ALLUM ROBERT DOUGLAS, FURLER SIA KATE I, MARTIN PHIL, MYER MATTHEW EDWARD;ASCAP
T3177149354;912062565;THE GREATEST;FURLER SIA KATE I, KENDRICK LAMAR, KURSTIN GREG;ASCAP
T9219564166;892758258;THE GREATEST (NON-KENDRICK VERSION);FURLER SIA KATE I, KURSTIN GREGORY ALLEN, MACKICHAN BLAIR NICHOLAS SOMERLED;ASCAP
T0614028748;885176016;THE HANDS I HOLD;BINNS HENRY, BRUDENELL-BRUCE CATHERINE ANNA, FURLER SIA KATE I, KURSTIN GREGORY ALLEN;ASCAP
T0608281226;502898977;THE PAGEANT OF THE BIZARRE;BINNS HENRY DANIEL, FURLER SIA KATE I, HARDAKER SAM;ASCAP
T9181345482;888328221;THE WHISPERER;FURLER SIA KATE I, GUETTA DAVID, TUINFORT GIORGIO H;ASCAP
T0608406207;502946076;THIS FINE SOCIAL SCENE;BINNS HENRY DANIEL, FURLER SIA KATE I, HARDAKER SAM;ASCAP
 ;502959553;THISSELS;BINNS HENRY, FURLER SIA KATE I, HARDAKER SAM;ASCAP
T0608406172;908738282;THISTLES;BINNS HENRY, FURLER SIA KATE I, HARDAKER SAM;ASCAP
T0615440862;888122432;THROW DOWN THE ROSES;AUSTIN DALLAS, FURLER SIA KATE I, PIERSON KATE;ASCAP
T0608857448;502946236;THROW IT ALL AWAY;BINNS HENRY DANIEL, FURLER SIA KATE I, HARDAKER SAM, MADDEN DAVID;ASCAP
T9256936955;895384390;THUNDERCLOUDS;ALLEN HENRY AGINCOURT, FURLER SIA KATE I, MCKENZIE TIMOTHY LEE, MECKSEPER PHILIP, PENTZ THOMAS WESLEY;ASCAP
T9169991564;888954092;TIDE;FURLER SIA KATE I, WHITE FRANCIS ANTHONY;ASCAP
 ;888122433;TIME WAVE ZERO;ANDERSON TIM R, FURLER SIA KATE I, PIERSON KATE;ASCAP
T9109792292;883332453;TITANIUM;FURLER SIA KATE I, GUETTA DAVID, TUINFORT GIORGIO H, WALL VAN DE NICK L, WALL VAN DE NICK L;ASCAP
T3039224534;911238911;TITANS;FURLER SIA KATE I, GOLDSTEIN YONATAN, JONG DE BOAZ, MCKENZIE TIMOTHY LEE, MECKSEPER PHILIP, PENTZ THOMAS WESLEY;ASCAP
T9229867236;893545937;TOGETHER;FURLER SIA KATE I, TAYLOR ROBERT SHEA;ASCAP
T9327646311;907908167;TOGETHER;ANTONOFF JACK, FURLER SIA KATE I;ASCAP
 ;883896857;TOWN BIKE;FRANK SAM, FURLER SIA KATE I;ASCAP
T9212957727;892087803;TOY BOX;AUSTIN DALLAS, FURLER SIA KATE I, NITTA CORY THOMAS;ASCAP
T0604179512;917316694;TRIPOUTRO;FURLER SIA KATE I;ASCAP
T0603129356;917317450;TRIPPY;FURLER SIA KATE I;ASCAP
 ;885675709;TRUST IN IT;FURLER SIA KATE I, GLUCK WILL, HULL TOM, KURSTIN GREGORY ALLEN;ASCAP
T9188629096;890227017;TRY EVERYTHING;ERIKSEN MIKKEL STORLEER, FURLER SIA KATE I, HERMANSEN TOR ERIK;ASCAP
T9142654544;887002201;TWO SHRINKS;FURLER SIA KATE I, KURSTIN GREGORY ALLEN;ASCAP
T0607667822;510331518;U CAN DO IT;DIXON SAM, FURLER SIA KATE I, FURLER SIA KATE I;ASCAP
T9231477897;893608145;UNDERNEATH THE CHRISTMAS LIGHTS;FURLER SIA KATE I, KURSTIN GREG;ASCAP
T9231477900;893608146;UNDERNEATH THE MISTLETOE;FURLER SIA KATE I, KURSTIN GREG;ASCAP
T0615045505;889413962;UNSTOPPABLE;BRAIDE CHRISTOPHER KENNETH, FURLER SIA KATE I;ASCAP
T9179606521;920757947;UNSTOPPABLE;BRAIDE CHRISTOPHER KENNETH, FURLER SIA KATE I;ASCAP
T3184301671;920773752;UNSTOPPABLE (WINNER);BRAIDE CHRISTOPHER KENNETH, FURLER SIA KATE I;ASCAP
T9148017598;510331492;UNTANGLE;FURLER SIA KATE I, KURSTIN GREG;ASCAP
T0608774679;510335774;UNTANGLE;FURLER SIA KATE I, KURSTIN GREG;ASCAP
T0608825155;510517130;UTOPIA;FURLER SIA KATE I, KURSTIN GREGORY ALLEN;ASCAP
 ;884186345;VAGUE A L'AME;FURLER SIA KATE I, GUYON HELENE, JOHANNSSON BARDI, KATZ JULIETTE SARAH ZOE;ASCAP
T3160150998;919814280;VIOLET CHEMISTRY;CYRUS MILEY RAY, FURLER SIA KATE I, SHATKIN JESSE SAMUEL, WILLIAMS MICHAEL LEN;ASCAP
 ;894793585;VOLCANO;CANDY BROOKE, FURLER SIA KATE I, GELLER JESSE ST JOHN, NITTA CORY;ASCAP
T0605618867;917317571;WAITING FOR YOU;CORSBIE NIGEL BRUCE, FURLER SIA KATE I;ASCAP
T0608406058;531707396;WAITING TO DIE;BINNS HENRY DANIEL, FURLER SIA KATE I, HARDAKER SAM;ASCAP
 ;885215979;WALK ON FIRE;FURLER SIA KATE I, KURSTIN GREGORY ALLEN, SUDDUTH JOHN;ASCAP
T0614423845;885186023;WAR GAMES;BRAIDE CHRISTOPHER KENNETH, FURLER SIA KATE I;ASCAP
T0617935815;891822932;WARRIOR;DIXON SAMUEL RONALD, FURLER SIA KATE I;ASCAP
T0617486642;892280001;WATERFALL;ERIKSEN MIKKEL STORLEER, FURLER SIA KATE I, HERMANSEN TOR ERIK, MECKSEPER PHILIP, PENTZ THOMAS WESLEY;ASCAP
T9190732695;890413315;WAVING GOODBYE;FURLER SIA KATE I, PENTZ THOMAS WESLEY, SWANSON ANDREW FITZGERALD;ASCAP
T9142928914;887351882;WE ARE ONE OLE OLA;FURLER SIA KATE I, GOTTWALD LUKASZ, INACIO CLAUDIA CRISTINA LEITE, KHAYAT NADIR, LOPEZ JENNIFER, MURCIA DANIEL, PEREZ ARMANDO CHRISTIAN, TROELSEN THOMAS SKOV, WALTER HENRY RUSSELL;ASCAP
T3136237924;918448648;WE CAN DO ANYTHING;FURLER SIA KATE I, KARLSSON CHRISTIAN LARS, LIDEHALL MAGNUS CARL ERIK, PONTARE VINCENT FRED;ASCAP
T0616265350;889168171;WE UNRAVEL;FURLER SIA KATE I, KRAUS OLIVER;ASCAP
T9283171506;896777702;WELCOME TO THE WONDERFUL WORLD OF;FURLER SIA KATE I, MCKENZIE TIMOTHY LEE, PENTZ THOMAS WESLEY;ASCAP
T9283171506;897194219;WELCOME TO THE WONDERFUL WORLD OF LSD;FURLER SIA KATE I, MCKENZIE TIMOTHY LEE, PENTZ THOMAS WESLEY;ASCAP
T3011973385;909440695;WHAT THE FUTURE HOLDS;FURLER SIA KATE I, KURSTIN GREG;ASCAP
T0606945394;531364819;WHERE I BELONG;DIXON SAMUEL RONALD, FURLER SIA KATE I;ASCAP
T0607490050;883896836;WHY DENY?;FRANK SAM, FURLER SIA KATE I;ASCAP
T9093292309;884561784;WILD ONE TOO;COOPER MARCUS, DILLARD TRAMAR LACEL, FURLER SIA KATE I, HEDFORS AXEL CHRISTOFER, JUDRIN RAPHAEL DAVID, LUTTRELL JACOB ELISHA, MADDAHI BEN, MELKI PIERRE-ANTOINE JOSEPH MICHEL;ASCAP
T9120481096;883631127;WILD ONES;COOPER MARCUS, DILLARD TRAMAR LACEL, FURLER SIA KATE I, HEDFORS AXEL CHRISTOFER, JUDRIN RAPHAEL DAVID, LUTTRELL JACOB ELISHA, MADDAHI BEN, MELKI PIERRE-ANTOINE JOSEPH MICHEL;ASCAP
T0607152146;905280833;WINTER IN HAWAII;DIXON SAMUEL RONALD, FURLER SIA KATE I;ASCAP
T0615096848;886375769;WITHOUT A FIGHT;DIXON SAMUEL RONALD, FURLER SIA KATE I;ASCAP
T9202683554;888825970;WOLVES;BRINSMEAD ALAN, DEAN MIKE, DOCKERY KIRBY LAURYEN, FURLER SIA KATE I, GOLDSTEIN NOAH D, HOIBERG MAGNUS, JONES MALIK YUSEF EL SHABAZZ, MCDERMOTT RYAN FRANCIS, MENSA VIC, REYNOLDS PATRICK, RUTBERG ELON, UNKNOWN WRITER, WEST KANYE OMARI, YOUNG CYDEL CHARLES;ASCAP
T9268044015;895894016;WONDERFUL;FURLER SIA KATE I, SHATKIN JESSE SAMUEL;ASCAP
 ;890679483;WORLD CHAMPIONSHIP FINALE 2;CAREN MICHAEL, COTTER JARED, CREWE BOB, DILLARD TRAMAR LACEL, EKLOW LINUS JOHAN, ERRICO GREG, FURLER SIA KATE I, GESTEELDE-DIAMANT TERIUS ADAMU YA, GOTTWALD LUKASZ, GUETTA DAVID, GUZMAN CARLOS, HAMILTON PRISCILLA, HJELT CAROLINE ELISABETH, ISAAC BREYAN STANLEY, JAWO AINO NENEH, KNOWLES BEYONCE GISSELLE, LOELV ELOF FRED KARL, LOWEN ERIC, MARAJ ONIKA TANYA, MEJIA MARIO, MOORE JASON, MORIER NICOLE, NAVARRO DANIEL, NOLAN KENNY, OSKAR KERI, OSKAR LEE, PALMER ADIDJA AZIM, PENTZ THOMAS WESLEY, PEREZ ARMANDO CHRISTIAN, SALINAS JUAN CARLOS, SALINAS OSCAR EDWARD, SANDERSON JAMIE MICHAEL ROBERT, SEBERT KESHA, SMITH SAMUEL, SVIDDEN, TAYLOR DAVID JAMES ANDREW, TOVE LO, TUINFORT GIORGIO H, WALL VAN DE NICK L, WALTER HENRY RUSSELL, WILHELM SANDY;ASCAP
T9237676414;894207763;WRAPPED UP;FURLER SIA KATE I, KURSTIN GREG;ASCAP
T0608774691;883896850;YOU ARE A LIAR;FRANK SAM, FURLER SIA KATE I;ASCAP
 ;551042736;YOU DON'T KNOW;DIXON SAMUEL RONALD, FURLER SIA KATE I, YOUNG WILL;ASCAP
T9030355738;550292923;YOU HAVE BEEN LOVED;FURLER SIA KATE I, JONES CLIFF, VETTESE PETER JOHN;ASCAP
