ISWC;workId;title;creators;source
T0611563951;881250498;YOU LOST ME;AGUILERA CHRISTINA, DIXON SAMUEL RONALD, FURLER SIA KATE I;ASCAP
 ;550717956;YOU MADE A FOOL OF ME;ALLUM ROBERT DOUGLAS, FURLER SIA KATE I, MARTIN PHILIP CHARLES, MYER MATTHEW EDWARD TRISTRAM;ASCAP
 ;550407031;YOU NEVER EXISTED;CAREY DANIEL DE MUSSENDEN, FURLER SIA KATE I;ASCAP
T9157740302;887858397;YOU RE NEVER FULLY DRESSED WITHOUT A SMILE (2;CHARNIN MARTIN, FURLER SIA KATE I, GLUCK WILLIAM, KURSTIN GREGORY ALLEN, STROUSE CHARLES;ASCAP
T0607667833;550549834;YOUR ROOM;DIXON SAM, FURLER SIA KATE I, FURLER SIA KATE I;ASCAP
T0614423856;885186022;YOU'RE MINE;BRAIDE CHRISTOPHER KENNETH, FURLER SIA KATE I;ASCAP
T0608665162;550663157;YOU'RE MY FLAME;BINNS HENRY DANIEL, FURLER SIA KATE I, HARDAKER SAM;ASCAP
 ;887334979;Z VYSKY;COOPER MARCUS, DILLARD TRAMAR LACEL, FURLER SIA KATE I, HEDFORS AXEL CHRISTOFER, JUDRIN RAPHAEL, LUTTRELL JACOB, MADDAHI BEN, MELKI PIERRE-ANTOINE;ASCAP
 ;889567984;ZTRATIL JSI MNE;AGUILERA CHRISTINA, DIXON SAM, FURLER SIA KATE I;ASCAP
T9195681517;905040438;ZVYSKY;COOPER MARCUS, DILLARD TRAMAR LACEL, FURLER SIA KATE I, HEDFORS AXEL CHRISTOFER, JUDRIN RAPHAEL DAVID, LUTTRELL JACOB ELISHA, MADDAHI BEN, MELKI PIERRE-ANTOINE JOSEPH MICHEL;ASCAP
 ;912535533;1 + 1 FEAT AMIR;FURLER SIA KATE I, HADDAD AMIR JOHN, SHATKIN JESSE SAMUEL;ASCAP
T0617935893;893195967;1+1;FURLER SIA KATE I, SHATKIN JESSE SAMUEL;ASCAP
T3141758961;918979021;12 NIGHTS;FURLER SIA KATE I, SERNA ERICK, SHATKIN JESSE SAMUEL;ASCAP
T3141758972;918979062;3 MINUTES 'TIL NEW YEARS;FURLER SIA KATE I, SERNA ERICK, SHATKIN JESSE SAMUEL;ASCAP
T9123509013;904859375;85 BLOCKS;AHLUND JOAKIM FRANS, FURLER SIA KATE I, STONE OLIVIA DIANE;ASCAP