ISWC;workId;title;creators;source;date
 ;885675709;TRUST IN IT;FURLER SIA KATE I, GLUCK WILL, HULL TOM, KURSTIN GREGORY ALLEN;ASCAP;2023.10.17
T9188629096;890227017;TRY EVERYTHING;ERIKSEN MIKKEL STORLEER, FURLER SIA KATE I, HERMANSEN TOR ERIK;ASCAP;2023.10.17
T9142654544;887002201;TWO SHRINKS;FURLER SIA KATE I, KURSTIN GREGORY ALLEN;ASCAP;2023.10.17
T0607667822;510331518;U CAN DO IT;DIXON SAM, FURLER SIA KATE I, FURLER SIA KATE I;ASCAP;2023.10.17
T9231477897;893608145;UNDERNEATH THE CHRISTMAS LIGHTS;FURLER SIA KATE I, KURSTIN GREG;ASCAP;2023.10.17
T9231477900;893608146;UNDERNEATH THE MISTLETOE;FURLER SIA KATE I, KURSTIN GREG;ASCAP;2023.10.17
T0615045505;889413962;UNSTOPPABLE;BRAIDE CHRISTOPHER KENNETH, FURLER SIA KATE I;ASCAP;2023.10.17
T9179606521;920757947;UNSTOPPABLE;BRAIDE CHRISTOPHER KENNETH, FURLER SIA KATE I;ASCAP;2023.10.17
T3184301671;920773752;UNSTOPPABLE (WINNER);BRAIDE CHRISTOPHER KENNETH, FURLER SIA KATE I;ASCAP;2023.10.17
T9148017598;510331492;UNTANGLE;FURLER SIA KATE I, KURSTIN GREG;ASCAP;2023.10.17
T0608774679;510335774;UNTANGLE;FURLER SIA KATE I, KURSTIN GREG;ASCAP;2023.10.17
T0608825155;510517130;UTOPIA;FURLER SIA KATE I, KURSTIN GREGORY ALLEN;ASCAP;2023.10.17
 ;884186345;VAGUE A L'AME;FURLER SIA KATE I, GUYON HELENE, JOHANNSSON BARDI, KATZ JULIETTE SARAH ZOE;ASCAP;2023.10.17
T3160150998;919814280;VIOLET CHEMISTRY;CYRUS MILEY RAY, FURLER SIA KATE I, SHATKIN JESSE SAMUEL, WILLIAMS MICHAEL LEN;ASCAP;2023.10.17
 ;894793585;VOLCANO;CANDY BROOKE, FURLER SIA KATE I, GELLER JESSE ST JOHN, NITTA CORY;ASCAP;2023.10.17
T0605618867;917317571;WAITING FOR YOU;CORSBIE NIGEL BRUCE, FURLER SIA KATE I;ASCAP;2023.10.17
T0608406058;531707396;WAITING TO DIE;BINNS HENRY DANIEL, FURLER SIA KATE I, HARDAKER SAM;ASCAP;2023.10.17
 ;885215979;WALK ON FIRE;FURLER SIA KATE I, KURSTIN GREGORY ALLEN, SUDDUTH JOHN;ASCAP;2023.10.17
T0614423845;885186023;WAR GAMES;BRAIDE CHRISTOPHER KENNETH, FURLER SIA KATE I;ASCAP;2023.10.17
T0617935815;891822932;WARRIOR;DIXON SAMUEL RONALD, FURLER SIA KATE I;ASCAP;2023.10.17
T0617486642;892280001;WATERFALL;ERIKSEN MIKKEL STORLEER, FURLER SIA KATE I, HERMANSEN TOR ERIK, MECKSEPER PHILIP, PENTZ THOMAS WESLEY;ASCAP;2023.10.17
T9190732695;890413315;WAVING GOODBYE;FURLER SIA KATE I, PENTZ THOMAS WESLEY, SWANSON ANDREW FITZGERALD;ASCAP;2023.10.17
T9142928914;887351882;WE ARE ONE OLE OLA;FURLER SIA KATE I, GOTTWALD LUKASZ, INACIO CLAUDIA CRISTINA LEITE, KHAYAT NADIR, LOPEZ JENNIFER, MURCIA DANIEL, PEREZ ARMANDO CHRISTIAN, TROELSEN THOMAS SKOV, WALTER HENRY RUSSELL;ASCAP;2023.10.17
T3136237924;918448648;WE CAN DO ANYTHING;FURLER SIA KATE I, KARLSSON CHRISTIAN LARS, LIDEHALL MAGNUS CARL ERIK, PONTARE VINCENT FRED;ASCAP;2023.10.17
T0616265350;889168171;WE UNRAVEL;FURLER SIA KATE I, KRAUS OLIVER;ASCAP;2023.10.17
T9283171506;896777702;WELCOME TO THE WONDERFUL WORLD OF;FURLER SIA KATE I, MCKENZIE TIMOTHY LEE, PENTZ THOMAS WESLEY;ASCAP;2023.10.17
T9283171506;897194219;WELCOME TO THE WONDERFUL WORLD OF LSD;FURLER SIA KATE I, MCKENZIE TIMOTHY LEE, PENTZ THOMAS WESLEY;ASCAP;2023.10.17
T3011973385;909440695;WHAT THE FUTURE HOLDS;FURLER SIA KATE I, KURSTIN GREG;ASCAP;2023.10.17
T0606945394;531364819;WHERE I BELONG;DIXON SAMUEL RONALD, FURLER SIA KATE I;ASCAP;2023.10.17
T0607490050;883896836;WHY DENY?;FRANK SAM, FURLER SIA KATE I;ASCAP;2023.10.17
T9093292309;884561784;WILD ONE TOO;COOPER MARCUS, DILLARD TRAMAR LACEL, FURLER SIA KATE I, HEDFORS AXEL CHRISTOFER, JUDRIN RAPHAEL DAVID, LUTTRELL JACOB ELISHA, MADDAHI BEN, MELKI PIERRE-ANTOINE JOSEPH MICHEL;ASCAP;2023.10.17
T9120481096;883631127;WILD ONES;COOPER MARCUS, DILLARD TRAMAR LACEL, FURLER SIA KATE I, HEDFORS AXEL CHRISTOFER, JUDRIN RAPHAEL DAVID, LUTTRELL JACOB ELISHA, MADDAHI BEN, MELKI PIERRE-ANTOINE JOSEPH MICHEL;ASCAP;2023.10.17
T0607152146;905280833;WINTER IN HAWAII;DIXON SAMUEL RONALD, FURLER SIA KATE I;ASCAP;2023.10.17
T0615096848;886375769;WITHOUT A FIGHT;DIXON SAMUEL RONALD, FURLER SIA KATE I;ASCAP;2023.10.17
T9202683554;888825970;WOLVES;BRINSMEAD ALAN, DEAN MIKE, DOCKERY KIRBY LAURYEN, FURLER SIA KATE I, GOLDSTEIN NOAH D, HOIBERG MAGNUS, JONES MALIK YUSEF EL SHABAZZ, MCDERMOTT RYAN FRANCIS, MENSA VIC, REYNOLDS PATRICK, RUTBERG ELON, UNKNOWN WRITER, WEST KANYE OMARI, YOUNG CYDEL CHARLES;ASCAP;2023.10.17
T9268044015;895894016;WONDERFUL;FURLER SIA KATE I, SHATKIN JESSE SAMUEL;ASCAP;2023.10.17
 ;890679483;WORLD CHAMPIONSHIP FINALE 2;CAREN MICHAEL, COTTER JARED, CREWE BOB, DILLARD TRAMAR LACEL, EKLOW LINUS JOHAN, ERRICO GREG, FURLER SIA KATE I, GESTEELDE-DIAMANT TERIUS ADAMU YA, GOTTWALD LUKASZ, GUETTA DAVID, GUZMAN CARLOS, HAMILTON PRISCILLA, HJELT CAROLINE ELISABETH, ISAAC BREYAN STANLEY, JAWO AINO NENEH, KNOWLES BEYONCE GISSELLE, LOELV ELOF FRED KARL, LOWEN ERIC, MARAJ ONIKA TANYA, MEJIA MARIO, MOORE JASON, MORIER NICOLE, NAVARRO DANIEL, NOLAN KENNY, OSKAR KERI, OSKAR LEE, PALMER ADIDJA AZIM, PENTZ THOMAS WESLEY, PEREZ ARMANDO CHRISTIAN, SALINAS JUAN CARLOS, SALINAS OSCAR EDWARD, SANDERSON JAMIE MICHAEL ROBERT, SEBERT KESHA, SMITH SAMUEL, SVIDDEN, TAYLOR DAVID JAMES ANDREW, TOVE LO, TUINFORT GIORGIO H, WALL VAN DE NICK L, WALTER HENRY RUSSELL, WILHELM SANDY;ASCAP;2023.10.17
T9237676414;894207763;WRAPPED UP;FURLER SIA KATE I, KURSTIN GREG;ASCAP;2023.10.17
T0608774691;883896850;YOU ARE A LIAR;FRANK SAM, FURLER SIA KATE I;ASCAP;2023.10.17
 ;551042736;YOU DON'T KNOW;DIXON SAMUEL RONALD, FURLER SIA KATE I, YOUNG WILL;ASCAP;2023.10.17
T9030355738;550292923;YOU HAVE BEEN LOVED;FURLER SIA KATE I, JONES CLIFF, VETTESE PETER JOHN;ASCAP;2023.10.17
T0611563951;881250498;YOU LOST ME;AGUILERA CHRISTINA, DIXON SAMUEL RONALD, FURLER SIA KATE I;ASCAP;2023.10.17
 ;550717956;YOU MADE A FOOL OF ME;ALLUM ROBERT DOUGLAS, FURLER SIA KATE I, MARTIN PHILIP CHARLES, MYER MATTHEW EDWARD TRISTRAM;ASCAP;2023.10.17
 ;550407031;YOU NEVER EXISTED;CAREY DANIEL DE MUSSENDEN, FURLER SIA KATE I;ASCAP;2023.10.17
T9157740302;887858397;YOU RE NEVER FULLY DRESSED WITHOUT A SMILE (2;CHARNIN MARTIN, FURLER SIA KATE I, GLUCK WILLIAM, KURSTIN GREGORY ALLEN, STROUSE CHARLES;ASCAP;2023.10.17
T0607667833;550549834;YOUR ROOM;DIXON SAM, FURLER SIA KATE I, FURLER SIA KATE I;ASCAP;2023.10.17
T0614423856;885186022;YOU'RE MINE;BRAIDE CHRISTOPHER KENNETH, FURLER SIA KATE I;ASCAP;2023.10.17
T0608665162;550663157;YOU'RE MY FLAME;BINNS HENRY DANIEL, FURLER SIA KATE I, HARDAKER SAM;ASCAP;2023.10.17
 ;887334979;Z VYSKY;COOPER MARCUS, DILLARD TRAMAR LACEL, FURLER SIA KATE I, HEDFORS AXEL CHRISTOFER, JUDRIN RAPHAEL, LUTTRELL JACOB, MADDAHI BEN, MELKI PIERRE-ANTOINE;ASCAP;2023.10.17
 ;889567984;ZTRATIL JSI MNE;AGUILERA CHRISTINA, DIXON SAM, FURLER SIA KATE I;ASCAP;2023.10.17
T9195681517;905040438;ZVYSKY;COOPER MARCUS, DILLARD TRAMAR LACEL, FURLER SIA KATE I, HEDFORS AXEL CHRISTOFER, JUDRIN RAPHAEL DAVID, LUTTRELL JACOB ELISHA, MADDAHI BEN, MELKI PIERRE-ANTOINE JOSEPH MICHEL;ASCAP;2023.10.17
 ;912535533;1 + 1 FEAT AMIR;FURLER SIA KATE I, HADDAD AMIR JOHN, SHATKIN JESSE SAMUEL;ASCAP;2023.10.17
T0617935893;893195967;1+1;FURLER SIA KATE I, SHATKIN JESSE SAMUEL;ASCAP;2023.10.17
T3141758961;918979021;12 NIGHTS;FURLER SIA KATE I, SERNA ERICK, SHATKIN JESSE SAMUEL;ASCAP;2023.10.17
T3141758972;918979062;3 MINUTES 'TIL NEW YEARS;FURLER SIA KATE I, SERNA ERICK, SHATKIN JESSE SAMUEL;ASCAP;2023.10.17
T9123509013;904859375;85 BLOCKS;AHLUND JOAKIM FRANS, FURLER SIA KATE I, STONE OLIVIA DIANE;ASCAP;2023.10.17
 ;904440481;ALL THE DJS LOVE YOU IN NEW YORK;ASLAN, FURLER SIA KATE I, HOWARD FELIX STARBUCK;ASCAP;2023.10.23
T0609484287;322776350;BUTTONS;FURLER SIA KATE I, HUNTINGTON NICK, MC GROARTY MICHAEL T;ASCAP;2023.10.23
 ;922128459;3 MINUTES TO MIDNIGHT (PROMO);FURLER SIA KATE I, SHATKIN JESSE SAMUEL;ASCAP;2023.10.24
T0607304539;922148958;HILLS AND PEAKS;DIXON SAMUEL RONALD, FURLER SIA KATE I;ASCAP;2023.10.30
T0610333635;922152324;YOU DON T KNOW;DIXON SAMUEL RONALD, FURLER SIA KATE I, YOUNG WILLIAM ROBERT;ASCAP;2023.10.30
T9130563610;886171376;CANNONBALL;ERIKSEN MIKKEL STORLEER, FURLER SIA KATE I, HERMANSEN TOR ERIK, LEVIN BENJAMIN JOSEPH;ASCAP;2023.12.3
T0615867076;909432968;WHISPERER;FURLER SIA KATE I, GUETTA PIERRE DAVID, TUINFORT GIORGIO H;ASCAP;2023.12.3
 ;891650042;WOLVES;BRINSMEAD ALAN, DEAN MIKE, FURLER SIA KATE I, GOLDSTEIN NOAH D, HOIBERG MAGNUS, LAURYEN KIRBY, MCDERMOTT RYAN, MENSAH VICTOR KWESI, REYNOLDS PAT, RUTBERG ELON, WEST KANYE, WEXLER FREDDY, YOUNG CYDEL, YUSEF MALIK;ASCAP;2023.12.3
 ;885187480;WRAPPED AROUND YOUR FINGER;BRAIDE CHRISTOPHER KENNETH, FURLER SIA KATE I, MCPHEE KATHARINE;ASCAP;2023.12.3
T9240480346;894193990;YOUR BODY TALK;BRAIDE CHRISTOPHER KENNETH, FURLER SIA KATE I;ASCAP;2023.12.3
T0611251092;897129953;YOU'VE CHANGED;FLAX LAUREN, FURLER SIA KATE I;ASCAP;2023.12.3
T9159316935;887964696;FLAMES;BRAIDE CHRISTOPHER KENNETH, FURLER SIA KATE I, GUETTA DAVID, TUINFORT GIORGIO H, WATTUM VAN MARCUS C;ASCAP;2023.12.18
 ;922763881;HAAS HAAS;BAJWA INDER, DOSANJH DILJIT, FURLER SIA KATE I, KURSTIN GREG;ASCAP;2023.12.20
T3224576012;922735251;TITANIUM (NINA SOFIE VERSION);FURLER SIA KATE I, GUETTA PIERRE DAVID, TUINFORT GIORGIO H, WALL VAN DE NICK L;ASCAP;2023.12.20
 ;923185475;CHAMPION FEAT. TIERRA WHACK, KALIII AND JIMMY;BROWN ERNEST EUGENE III, FURLER SIA KATE I, GOODS JOSHUA DAIQUAN, JOLIFF JIMMY, SHATKIN JESSE SAMUEL, WHACK-WELTON TIERRA;ASCAP;2024.2.1
 ;923791452;DANCE ALONE;FURLER SIA KATE I, SHATKIN JESSE SAMUEL;ASCAP;2024.2.26